post_score,is_original,post_title,post_archived,post_distinguished,post_downs,post_edited,post_gilded,post_gilded_silver,post_gilded_gold,post_gilded_platinum,post_is_original_content,post_is_video,post_likes,post_num_comments,post_num_crossposts,post_num_reports,post_over_18,post_pinned,subreddit,subreddit_subscribers,post_ups,posted_len_minutes,post_title_sentiment,post_title_characters,post_title_words,post_title_uniq_words,post_title_stop_words,post_title_non_stop_words,post_text_sentiment,post_text_characters,post_text_words,post_text_uniq_words,post_text_stop_words,post_text_non_stop_words,day_of_week
3,True,I keep hearing that we have technically been under martial law for a long time. Can someone show me proof?,False,,0,False,0,0,0,0,False,False,,0,0,,False,False,conspiracy,795126,3,1440,-1,104,20,20,10,10,0,0,0,0,0,0,4
4,True,List of known good conspiracy theory discord servers?,False,,0,1550268141.0,0,0,0,0,False,False,,0,0,,False,False,conspiracy,795126,4,1440,1,52,8,8,1,7,1,121,20,19,7,12,4
1,True,Getting brigaded for dropping red pills,False,,0,False,0,0,0,0,False,False,,1,0,,False,False,conspiracy,795126,1,1440,0,39,6,6,1,5,0,0,0,0,0,0,4
0,True,"Autism, Made in the USA: the Undeniable Connection Between Vaccines and Autism Spectrum Disorder",False,,0,False,0,0,0,0,False,False,,0,0,,False,False,conspiracy,795126,0,1440,0,94,14,12,4,8,0,0,0,0,0,0,4
1,True,Why do commies use monarchies as examples of the success of Marxism?,False,,0,False,0,0,0,0,False,False,,1,0,,False,False,conspiracy,795126,1,1440,1,67,12,11,5,6,0,0,0,0,0,0,4
2,True,How A Foxy Company Can Protect Its Image from Ripple Effect,False,,0,False,0,0,0,0,False,False,,0,0,,False,False,conspiracy,795126,2,1440,0,59,11,11,5,6,0,0,0,0,0,0,4
3,True,Are US movie critics incentivized to bash films that originate from countries which aren't historical allies of the US?,False,,0,False,0,0,0,0,False,False,,9,0,,False,False,conspiracy,795126,3,1440,0,118,20,19,9,10,0,0,0,0,0,0,4
1,True,"Can someone tell me whats really try to be snuck behind our back while we are ""occupied"" with the national emergency?",False,,0,False,0,0,0,0,False,False,,5,0,,False,False,conspiracy,795126,1,1440,-1,114,21,21,10,11,0,0,0,0,0,0,4
3,True,Chinese scientists developed what they call a “rat cyborg” that can be controlled wirelessly by a human mind. Researchers wearing an EEG hat navigated the rodents through a maze using blinks and shoulder shrugs. They say the same tech could be applied to a human-to-human mind interface.,False,,0,False,0,0,0,0,False,False,,6,0,,False,False,conspiracy,795126,3,1440,1,282,49,39,13,26,0,0,0,0,0,0,4
3,True,"3 year old gets M MR, regresses into au tism",False,,0,False,0,0,0,0,False,False,,0,0,,False,False,conspiracy,795126,3,1440,1,43,10,10,2,8,1,710,133,98,37,61,4
5,True,Al Gore's Global Warming Deliberate Fraud to Increase Governmental Power,False,,0,False,0,0,0,0,False,False,,3,0,,False,False,conspiracy,795126,5,1440,0,72,11,11,2,9,0,0,0,0,0,0,4
4,True,Fall of Democracy in the USA Predictions,False,,0,False,0,0,0,0,False,False,,9,0,,False,False,conspiracy,795126,4,1440,0,40,7,7,3,4,-1,883,159,111,37,74,4
2,True,"Another example of social media shaping reality. Look at any Trump tweet, the top comment is always one of the Trump Trolls. Meanwhile a user today pointed out AOC hired her bf as part of her staff and his account has been suspended.",False,,0,False,0,0,0,0,False,False,,16,0,,False,False,conspiracy,795126,2,1440,1,229,43,38,13,25,0,0,0,0,0,0,4
2,True,2 The founder of /r/The_Donald (/u/jcm267) was a Russian counterintelligence agent. Prove me wrong.,False,,0,False,0,0,0,0,False,False,,17,0,,False,False,conspiracy,795126,2,1440,-1,93,17,16,5,11,0,0,0,0,0,0,4
2,True,"Aurora, IL shooting possible false flag?",False,,0,False,0,0,0,0,False,False,,12,0,,False,False,conspiracy,795126,2,1440,-1,38,6,6,0,6,-1,176,36,33,18,15,4
20,True,“Mass shooting” in IL Today,False,,0,False,0,0,0,0,False,False,,11,0,,False,False,conspiracy,795126,20,1440,0,25,5,5,1,4,-1,358,68,59,28,31,4
1,True,"If the 9/11 Commission Report is true, why are so many people in denial?",False,,0,False,0,0,0,0,False,False,,2,0,,False,False,conspiracy,795126,1,1440,1,70,15,15,7,8,0,0,0,0,0,0,4
3,True,"The Saudis ""Don't Know"" Where Jamal Khashoggi's Body Is",False,,0,False,0,0,0,0,False,False,,5,0,,False,False,conspiracy,795126,3,1440,0,53,11,11,6,5,0,0,0,0,0,0,4
0,True,Would repealing Roe v. Wade cause a Civil War?,False,,0,1550265321.0,0,0,0,0,False,False,,29,0,,False,False,conspiracy,795126,0,1440,0,44,9,9,1,8,0,145,25,25,11,14,4
0,True,Saw a post on here not to long ago with a graph showing CTR and Shareblue spamming reddit with pro Hillary posts. Can anyone link it for me?,False,,0,False,0,0,0,0,False,False,,0,0,,False,False,conspiracy,795126,0,1440,-1,138,28,26,11,15,0,20,5,4,2,2,4
0,True,"""you should try to take the set of actions that are likely to prolong civilization, minimize the probability of a dark age and reduce the length of a dark age if there is one""",False,,0,False,0,0,0,0,False,False,,2,0,,False,False,conspiracy,795126,0,1440,-1,172,34,26,12,14,1,2110,384,196,54,142,4
0,True,Apollo 12 - Why NASA can't explain these photographs...,False,,0,False,0,0,0,0,False,False,,3,0,,False,False,conspiracy,795126,0,1440,0,50,9,9,4,5,0,0,0,0,0,0,4
8,True,"Syrian Sarin 'attack' was like the rest ,a US state dept. ruse. ISIS proven to be a US creation.",False,,0,False,0,0,0,0,False,False,,1,0,,False,False,conspiracy,795126,8,1440,0,90,19,17,5,12,0,0,0,0,0,0,4
1,True,The Future of Retail Is … Surveillance?,False,,0,False,0,0,0,0,False,False,,2,0,,False,False,conspiracy,795126,1,1440,0,36,6,6,3,3,0,0,0,0,0,0,4
2,True,"I just tried to post to showerthoughts, it says my post has a typo and was thus removed. I've checked it in three different typo checkers and none can find any typo.",False,,0,False,0,0,0,0,False,False,,10,0,,False,False,conspiracy,795126,2,1440,0,162,33,26,13,13,-1,186,41,34,18,16,4
5,True,"""I no longer love blue skies"": What life is like under the constant threat of a drone attack",False,,0,False,0,0,0,0,False,False,,5,0,,False,False,conspiracy,795126,5,1440,1,89,18,18,8,10,0,0,0,0,0,0,4
6,True,Venezuelan opposition releases fake video,False,,0,False,0,0,0,0,False,False,,4,0,,True,False,conspiracy,795126,6,1440,-1,41,5,5,0,5,0,0,0,0,0,0,4
0,True,Conspiracy,False,,0,False,0,0,0,0,False,False,,12,0,,False,False,conspiracy,795126,0,1440,0,10,1,1,0,1,1,131,24,21,11,10,4
0,True,"MK Ultra never disappeared, they just cool & edgy hypnotic images.",False,,0,False,0,0,0,0,False,False,,6,0,,False,False,conspiracy,795126,0,1440,1,62,10,10,2,8,0,0,0,0,0,0,4
9,True,RGB back to work,False,,0,False,0,0,0,0,False,False,,17,0,,False,False,conspiracy,795126,9,1440,0,16,4,4,1,3,0,0,0,0,0,0,4
5,True,Moon Landing Conspiracy Compilation,False,,0,1550267670.0,0,0,0,0,False,False,,3,0,,False,False,conspiracy,795126,5,1440,0,35,4,4,0,4,1,7645,1341,611,78,533,4
50,True,"A jury decided that Princess Diana was ""unlawfully killed"". Later it emerged that she had written a note that ""my husband is planning an ""accident"" in my car."" Husband Prince Charles was not called to explain this.",False,,0,False,0,0,0,0,False,False,,5,0,,False,False,conspiracy,795126,50,1440,-1,205,37,31,13,18,0,0,0,0,0,0,4
0,True,"Turkish president accuses west of arming terrorists: ""From Daesh and PKK to Al Qaida and Al Shabaab, all terror organizations that shed the blood of Muslims have Western weapons in their hands""",False,,0,False,0,0,0,0,False,False,,3,0,,False,False,conspiracy,795126,0,1440,0,189,32,29,10,19,0,0,0,0,0,0,4
13,True,MI5 covered up sexual abuse at boys' home,False,,0,False,0,0,0,0,False,False,,2,0,,False,False,conspiracy,795126,13,1440,1,40,8,8,2,6,0,0,0,0,0,0,4
0,True,Petty Pelosi threatens that a Democrat President will hold a national emergency to take away your guns and sideline the 2nd amendment.,False,,0,False,0,0,0,0,False,False,,33,1,,False,False,conspiracy,795126,0,1440,0,133,22,21,7,14,0,0,0,0,0,0,4
0,True,"Investigators believe Russian senator paid $22,400 to have two people murdered",False,,0,False,0,0,0,0,False,False,,1,0,,False,False,conspiracy,795126,0,1440,0,77,12,12,2,10,0,0,0,0,0,0,4
6,True,what actually did Julian Assange mean when he said 'intelligent evil dust spread around like confetti in everything' in that interview he did for RUPTY' would love to know if people seen the interview and knew what he meant by this comment.,False,,0,False,0,0,0,0,False,False,,11,0,,False,False,conspiracy,795126,6,1440,-1,236,42,36,13,23,0,0,0,0,0,0,4
2,True,Amazon Cancels HQ2 Deal With NYC,False,,0,False,0,0,0,0,False,False,,3,0,,False,False,conspiracy,795126,2,1440,0,32,6,6,1,5,0,0,0,0,0,0,4
3,True,Novichok poisonings. How has is taken so long for the parents to talk? Fishy or what?,False,,0,False,0,0,0,0,False,False,,2,0,,False,False,conspiracy,795126,3,1440,-1,82,16,16,9,7,0,0,0,0,0,0,4
0,True,Martin Luther King Jr - The Beast As Saint,False,,0,False,0,0,0,0,False,False,,11,0,,False,False,conspiracy,795126,0,1440,0,40,8,8,2,6,0,0,0,0,0,0,4
3,True,Sonic Boom of Jodhpur,False,,0,False,0,0,0,0,False,False,,0,0,,False,False,conspiracy,795126,3,1440,0,21,4,4,1,3,1,2113,364,211,50,161,4
4,True,"The Magnetic Hill of Leh, Ladakh",False,,0,False,0,0,0,0,False,False,,4,0,,False,False,conspiracy,795126,4,1440,0,31,6,6,2,4,1,2198,363,205,55,150,4
8,True,Jussie Smollet CASE: Arrests have been made!,False,,0,False,0,0,0,0,False,False,,13,0,,False,False,conspiracy,795126,8,1440,0,42,7,7,2,5,0,0,0,0,0,0,4
12,True,Chinese scientists developed what they call a “rat cyborg” that can be controlled wirelessly by a human mind. Researchers wearing an EEG hat navigated the rodents through a maze using blinks and shoulder shrugs. They say the same tech could be applied to a human-to-human mind interface.,False,,0,False,0,0,0,0,False,False,,4,0,,False,False,conspiracy,795126,12,1440,1,282,49,39,13,26,0,0,0,0,0,0,4
7,True,Has there been a single mass shooting since 99 columbine where video evidence of the perpetrator at the scene was released? /alex jones/asshole youtuber rant,False,,0,1550257301.0,0,0,0,0,False,False,,10,0,,False,False,conspiracy,795126,7,1440,-1,155,26,25,9,16,1,3280,611,322,81,241,4
0,True,Rezz Hypnotizing & Mesmerizing Her Audience with Symbols and Sacred Geometry,False,,0,False,0,0,0,0,False,False,,9,0,,False,False,conspiracy,795126,0,1440,1,74,10,10,3,7,0,0,0,0,0,0,4
14,True,"Killer robots should be banned to prevent them wiping out humanity, scientists warn",False,,0,False,0,0,0,0,False,False,,17,0,,False,False,conspiracy,795126,14,1440,0,82,13,13,5,8,0,0,0,0,0,0,4
24,True,Do You Believe in the Deep State Now? The revelation that top Justice officials considered deposing Trump should answer that question for good.,False,,0,False,0,0,0,0,False,False,,13,0,,False,False,conspiracy,795126,24,1440,1,141,23,21,8,13,0,0,0,0,0,0,4
2,True,Jerome Corsi Sues Roger Stone for Defamation - Bloomberg,False,,0,False,0,0,0,0,False,False,,2,0,,False,False,conspiracy,795126,2,1440,0,54,8,8,1,7,0,0,0,0,0,0,4
6,True,They have broken her,False,,0,False,0,0,0,0,False,False,,23,0,,False,False,conspiracy,795126,6,1440,-1,20,4,4,3,1,0,0,0,0,0,0,4
0,True,McCabe is being attacked by state propaganda.,False,,0,1550263555.0,0,0,0,0,False,False,,39,0,,False,False,conspiracy,795126,0,1440,-1,44,7,7,3,4,1,489,87,78,26,52,4
76,True,Nancy Pelosi's brother-in-law received $737 million in loan guarantees from the Department of Energy,False,,0,False,0,0,0,0,False,False,,23,0,,False,False,conspiracy,795126,76,1440,0,99,17,16,5,11,0,0,0,0,0,0,4
4,True,Congresswoman Ilhan Omar married her own brother,False,,0,False,0,0,0,0,False,False,,33,0,,False,False,conspiracy,795126,4,1440,1,48,7,7,2,5,0,0,0,0,0,0,4
0,True,United Arab Emirates,False,,0,False,0,0,0,0,False,False,,7,0,,False,False,conspiracy,795126,0,1440,0,20,3,3,0,3,0,160,28,24,10,14,4
0,True,Are you on social media life support?,False,,0,False,0,0,0,0,False,False,,1,0,,False,False,conspiracy,795126,0,1440,1,36,7,7,3,4,0,0,0,0,0,0,4
0,True,Satellite data: No real increase in global warming for the last 23 years,False,,0,False,0,0,0,0,False,False,,7,0,,False,False,conspiracy,795126,0,1440,-1,71,13,13,4,9,0,0,0,0,0,0,4
1,True,Politics and the English Language By George Orwell,False,,0,False,0,0,0,0,False,False,,2,0,,False,False,conspiracy,795126,1,1440,0,50,8,8,3,5,0,0,0,0,0,0,4
127,True,What a coincidence that the comet ping pong shooter and arsonist both were actors.,False,,0,False,0,0,0,0,False,False,,55,0,,False,False,conspiracy,795126,127,1440,0,81,14,14,7,7,0,0,0,0,0,0,4
0,True,Donald Trump’s Current Mental Capacity [Discussion],False,,0,1550263877.0,0,0,0,0,False,False,,70,0,,False,False,conspiracy,795126,0,1440,-1,49,7,7,1,6,1,993,180,128,45,83,4
16,True,A turf war between federal regulators and local jurisdictions is brewing over the installation of hundreds of thousands of cellphone towers to upgrade to 5G know to cause health defects,False,,0,False,0,0,0,0,False,False,,13,0,,False,False,conspiracy,795126,16,1440,0,185,30,26,8,18,0,0,0,0,0,0,4
23,True,How exactly was Pizzagate “debunked”? Can anybody fill me in?,False,,0,False,0,0,0,0,False,False,,33,0,,False,False,conspiracy,795126,23,1440,1,57,10,10,5,5,-1,437,81,65,25,40,4
19,True,"Retard Republic: The bipartisan spending binge is now worse than under Bush and Obama - $22 trillion in debt. ""Humans cannot comprehend numbers as big as billions or trillions. One billion seconds is about 31 years...1 trillion seconds is about 31,000 years. 22 trillion seconds is 682,000 years""",False,,0,False,0,0,0,0,False,False,,14,0,,False,False,conspiracy,795126,19,1440,-1,285,51,37,12,25,0,0,0,0,0,0,4
0,True,American Dreamers | Icliks Incoming,False,,0,False,0,0,0,0,False,False,,1,0,,False,False,conspiracy,795126,0,1440,0,33,4,4,0,4,0,0,0,0,0,0,4
0,True,No Complex Society Can Be Socialist,False,,0,False,0,0,0,0,False,False,,4,0,,False,False,conspiracy,795126,0,1440,1,35,6,6,3,3,0,0,0,0,0,0,4
0,True,The Opportunity rover was never on Mars,False,,0,False,0,0,0,0,False,False,,23,0,,False,False,conspiracy,795126,0,1440,0,39,7,7,3,4,1,378,67,52,20,32,4
0,True,Why is Jusse Smollett flooding the sub today?,False,,0,False,0,0,0,0,False,False,,8,0,,False,False,conspiracy,795126,0,1440,0,44,8,8,3,5,-1,212,34,31,8,23,4
0,True,Have you noticed the lack of presence on the front page of Reddit for this shooting?,False,,0,False,0,0,0,0,False,False,,7,0,,False,False,conspiracy,795126,0,1440,0,83,16,14,7,7,0,0,0,0,0,0,4
0,True,"This is not a conspiracy, but this sub is likely the best ""thinking ground"" for me to share this idea. I guess you could call this a ""conspiracy to fuck Reddit""?",False,,0,False,0,0,0,0,False,False,,7,1,,False,False,conspiracy,795126,0,1440,1,154,31,24,11,13,1,11283,2132,634,105,529,4
15,True,Florida Outlaws Common Core After Parents Speak Out,False,,0,False,0,0,0,0,False,False,,40,0,,False,False,conspiracy,795126,15,1440,-1,51,8,8,2,6,0,0,0,0,0,0,4
41,True,"I don’t think anybody needs any convincing that the Jussie Smollett story is a complete fabrication, but do you guys find it odd that a reporter corroborating evidence when other searches had turned up empty? Link: https://chicago.cbslocal.com/2019/02/11/jussie-smollett-investigation-evidence/",False,,0,False,0,0,0,0,False,False,,20,0,,False,False,conspiracy,795126,41,1440,1,211,37,35,16,19,0,0,0,0,0,0,4
0,True,Google image search : south pole base map quiet dark.,False,,0,False,0,0,0,0,False,False,,5,0,,False,False,conspiracy,795126,0,1440,-1,50,9,9,0,9,0,0,0,0,0,0,4
30,True,Almost 20 years since the WTC Attacks and still no definitive answers.,False,,0,False,0,0,0,0,False,False,,17,0,,False,False,conspiracy,795126,30,1440,0,69,12,12,3,9,1,6426,1153,552,97,455,4
0,True,So I just watched this youtuber Shane D’s conspiracy theory about chuck e. cheese’s pizza. Whats your opinion?,False,,0,False,0,0,0,0,False,False,,6,0,,False,False,conspiracy,795126,0,1440,0,107,20,19,8,11,0,0,0,0,0,0,4
0,True,Alan Dershowitz: Ousting Trump via 25th Amendment is ‘clearly an attempt at a coup d’etat’,False,,0,False,0,0,0,0,False,False,,40,0,,False,False,conspiracy,795126,0,1440,1,87,16,16,5,11,0,0,0,0,0,0,4
0,True,"Amos '9:11' is a Bible passage - Israel's Restoration. With Israel's massive involvement in perpetrating 9/11, I found this to be yet another zionist fingerprint clueing in on who did the attack.",False,,0,False,0,0,0,0,False,False,,4,0,,False,False,conspiracy,795126,0,1440,0,188,35,30,13,17,0,12,4,4,0,4,4
9,True,What is up with Youtubes search bar/video alghoritm?,False,,0,False,0,0,0,0,False,False,,8,0,,False,False,conspiracy,795126,9,1440,0,51,9,9,4,5,1,531,112,83,36,47,4
6,True,"Let's call a spade a spade here... Immigrants must be examined by a Civil Surgeon and produce an inoculation record before a Visa is granted. They are trying to blame anti-vaxxers, but the real cause of the rise of disease is the enormous surge of unvaccinated migrants.",False,,0,False,0,0,0,0,False,False,,30,0,,False,False,conspiracy,795126,6,1440,1,264,49,40,15,25,1,572,100,69,25,44,4
5,True,Australia is still listening to Voyager 2 as NASA confirms the probe is now in interstellar space,False,,0,False,0,0,0,0,False,False,,5,0,,False,False,conspiracy,795126,5,1440,0,97,17,16,6,10,0,0,0,0,0,0,4
2,True,"Senate Intelligence Committee declares no Russian collusion - Will YouTube label all those old CNN and MSNBC videos as ""conspiracy theories"" and not promote them now?",False,,0,False,0,0,0,0,False,False,,7,0,,False,False,conspiracy,795126,2,1440,1,161,25,24,9,15,0,0,0,0,0,0,4
104,True,New analysis links glyphosate to 41% increased risk of cancer,False,,0,False,0,0,0,0,False,False,,12,0,,False,False,conspiracy,795126,104,1440,1,60,10,10,2,8,0,0,0,0,0,0,4
78,True,"US Company That Smuggled Weapons Into Venezuela Linked To CIA ""Black Site"" Renditions",False,,0,False,0,0,0,0,False,False,,2,0,,False,False,conspiracy,795126,78,1440,-1,83,13,13,3,10,0,0,0,0,0,0,4
1,True,The ‘Real’ St. Valentine Was No Patron of Love,False,,0,False,0,0,0,0,False,False,,0,0,,False,False,conspiracy,795126,1,1440,1,43,9,9,4,5,0,0,0,0,0,0,4
25,True,"Police/Ring doorbell camera company ""teaming up"" in invading your privacy",False,,0,False,0,0,0,0,False,False,,26,0,,False,False,conspiracy,795126,25,1440,0,71,11,11,3,8,-1,391,65,51,18,33,4
5,True,The cloud cover-up,False,,0,False,0,0,0,0,False,False,,11,0,,False,False,conspiracy,795126,5,1440,0,18,4,4,2,2,1,1731,308,183,49,134,4
0,True,"Rep Ilhan Omar destroys Trump's appointment as Venezuelan envoy, Elliot Abrams. His ass, it's handed to him.",False,,0,False,0,0,0,0,False,False,,14,0,,False,False,conspiracy,795126,0,1440,0,104,19,18,6,12,0,0,0,0,0,0,4
0,True,CantStumpTheTrump guy returns - what has happened? [video],False,,0,False,0,0,0,0,False,False,,1,0,,False,False,conspiracy,795126,0,1440,0,53,7,7,2,5,0,0,0,0,0,0,4
0,True,'No evidence' US actor attack was staged,False,,0,False,0,0,0,0,False,False,,44,0,,False,False,conspiracy,795126,0,1440,0,38,7,7,2,5,0,0,0,0,0,0,4
7,True,"Jim Acosta Just Questioned Whether ""The Angel Mom's"" Kids Were Actually Killed on CNN.",False,,0,False,0,0,0,0,False,False,,6,0,,False,False,conspiracy,795126,7,1440,-1,83,15,15,5,10,-1,304,59,44,18,26,4
0,True,The Holographic Nature of Reality - It's obvious if you think about it. Join the cult.,False,,0,False,0,0,0,0,False,False,,6,0,,False,False,conspiracy,795126,0,1440,0,82,16,14,7,7,0,0,0,0,0,0,4
26,True,"A reminder that over 30 ""national emergencies"" are currently in effect in the United States. Secret, unilateral powers are the norm, not the exception.",False,,0,False,0,1,0,0,False,False,,9,0,,False,False,conspiracy,795126,26,1440,-1,145,24,20,7,13,0,0,0,0,0,0,4
170,True,Operation Mockingbird is very real.,False,,0,False,0,0,0,0,False,False,,121,0,,False,False,conspiracy,795126,170,1440,1,34,5,5,2,3,0,0,0,0,0,0,4
0,True,"Major Predicted Events to Happen Through Numerology (Anyone With a Brain, Please Keep these Noted)",False,,0,False,0,0,0,0,False,False,,7,0,,False,False,conspiracy,795126,0,1440,1,95,15,15,5,10,-1,1152,216,116,41,75,4
53,True,"Networks: 2,202 Minutes on Russia Scandal, Zero for No Collusion Report",False,,0,False,0,0,0,0,False,False,,38,0,,False,False,conspiracy,795126,53,1440,0,69,12,12,3,9,0,0,0,0,0,0,4
42,True,Michael Jackson was meant to be at the top of one of the WTC Twin Towers on the morning of 9/11 but his lives was saved because he overslept,False,,0,False,0,0,0,0,False,False,,39,0,,False,False,conspiracy,795126,42,1440,1,140,30,25,11,14,0,0,0,0,0,0,4
0,True,Manfred Spitzer and the Digital Lobby,False,,0,False,0,0,0,0,False,False,,3,0,,False,False,conspiracy,795126,0,1440,0,37,6,6,2,4,1,1219,226,142,49,93,4
85,True,Having a ‘good’ job in America no longer makes you financially secure — 1 in 3 ‘moderate income’ Americans experience financial insecurity,False,,0,False,0,0,0,0,False,False,,58,0,,False,False,conspiracy,795126,85,1440,1,132,21,20,5,15,0,0,0,0,0,0,4
109,True,Comet Ping Pong arson suspect arrested - Another person with an acting background.,False,,0,False,0,0,0,0,False,False,,21,0,,False,False,conspiracy,795126,109,1440,0,79,12,12,2,10,0,0,0,0,0,0,4
50,True,Pro-Israel donors spent over $22m on lobbying and contributions in 2018 | US news,False,,0,False,0,0,0,0,False,False,,3,0,,False,False,conspiracy,795126,50,1440,-1,78,14,14,4,10,0,0,0,0,0,0,4
0,True,Simulation,False,,0,False,0,0,0,0,False,False,,4,0,,False,False,conspiracy,795126,0,1440,0,10,1,1,0,1,-1,1271,233,126,41,85,4
19,True,Vaccine shit-post,False,,0,False,0,0,0,0,False,False,,57,0,,False,False,conspiracy,795126,19,1440,-1,17,3,3,0,3,1,643,119,77,29,48,4
363,True,This sub is also censored from google auto complete,False,,0,False,0,0,0,0,False,False,,36,0,,False,False,conspiracy,795126,363,1440,1,51,9,9,3,6,0,0,0,0,0,0,4
1,True,"Smollett, two others in ""active interviews"" with Chicago police; Evidence of police ""slow play"" emerging",False,,0,False,0,0,0,0,False,False,,4,0,,False,False,conspiracy,795126,1,1440,-1,98,15,14,3,11,0,0,0,0,0,0,4
121,True,"As global insect population plunges toward total ecological collapse, the corporate-run media still censors the truth about GMOs",False,,0,False,0,0,0,0,False,False,,24,0,,False,False,conspiracy,795126,121,1440,1,127,19,18,3,15,0,0,0,0,0,0,4
40,True,"Trump to declare national emergency to build wall — The emergency declaration is an authoritarian move that overrides the constitutional separation of powers, elevating the executive branch above the legislative.",False,,0,False,0,0,0,0,False,False,,62,0,,False,False,conspiracy,795126,40,1440,0,208,29,24,7,17,0,0,0,0,0,0,4
51,True,"The Koch Brothers' Best Investment--2017 tax cuts provide Kochs with ""a return on investment of at least 4,100 percent"" and about a billion per year savings",False,,0,False,0,0,0,0,False,False,,4,0,,False,False,conspiracy,795126,51,1440,1,152,28,26,8,18,0,0,0,0,0,0,4
267,True,Jewish families ‘will leave UK’ to avoid lessons on gay relationships. Why aren't these families being accused of homophobia and Neo-Nazism by the MSM?,False,,0,False,0,0,0,0,False,False,,118,0,,False,False,conspiracy,795126,267,1440,1,147,26,25,12,13,0,0,0,0,0,0,4
7,True,Are all lotteries an actual scam?,False,,0,False,0,0,0,0,False,False,,13,0,,False,False,conspiracy,795126,7,1440,0,32,6,6,3,3,-1,436,81,60,28,32,4
51,True,"Texts show collusion between police and far-right extremists, Oregon official claims",False,,0,False,0,0,0,0,False,False,,26,0,,False,False,conspiracy,795126,51,1440,1,83,12,12,2,10,0,0,0,0,0,0,4
9,True,Our planet is slave of pure psychopaths=ruling class.,False,,0,1550236089.0,0,0,0,0,False,False,,9,0,,False,False,conspiracy,795126,9,1440,1,52,9,9,3,6,1,1757,340,171,62,109,4
2,True,"In case anyone needs it, this looks like a nice anonymous email option.",False,,0,False,0,0,0,0,False,False,,1,0,,False,False,conspiracy,795126,2,1440,1,69,13,13,4,9,0,0,0,0,0,0,4
1,True,The Jesuit (and Vatican) Conspiracy,False,,0,False,0,0,0,0,False,False,,0,0,,False,False,conspiracy,795126,1,1440,0,33,5,5,2,3,1,172,32,23,4,19,4
181,True,MK Ultra evolved to fit the modern day; brain washing is now done online en masse,False,,0,1550237102.0,0,0,0,0,False,False,,46,0,,False,False,conspiracy,795126,181,1440,1,80,16,16,4,12,1,1129,214,145,47,98,4
64,True,"BBC producer challenges narrative on Assad gassing Douma in 2018, says Syria hospital scenes were staged",False,,0,False,0,0,0,0,False,False,,31,0,,False,False,conspiracy,795126,64,1440,0,103,16,16,3,13,0,0,0,0,0,0,4
1,True,Fake News - fair complaint or blasphemy?,False,,0,False,0,0,0,0,False,False,,1,0,,False,False,conspiracy,795126,1,1440,-1,37,6,6,1,5,0,0,0,0,0,0,4
3,True,"Nazi holocaust, alternate story claimed by an original survivor. Keyword: sacrifice by burning alive to create a pentagram of negative vortices",False,,0,False,0,0,0,0,False,False,,9,0,,False,False,conspiracy,795126,3,1440,1,140,21,20,5,15,1,726,124,96,27,69,4
1578,True,"TIL iHeartRadio, the media conglomerate that owns most radio stations you know, 'auditions and hires actors to call in to talk radio shows and pose as listeners ... to provide shows ... with planned content in the form of stories and opinions.'",False,,0,False,0,0,0,0,False,False,,131,2,,False,False,conspiracy,795126,1578,1440,1,231,40,32,10,22,0,0,0,0,0,0,4
0,True,Russianvids Livestream Podcast With Dmurphy25,False,,0,False,0,0,0,0,False,False,,5,0,,False,False,conspiracy,795126,0,1440,0,45,5,5,1,4,1,144,25,23,11,12,4
15,True,Maybe McCabe thinks admitting to a coup will be less painful than admitting to an attempted assassination.,False,,0,False,0,0,0,0,False,False,,7,0,,False,False,conspiracy,795126,15,1440,-1,105,17,15,6,9,-1,204,35,33,9,24,4
0,True,The “vacuum of space” and concept of “gravity” are bullshit. NASA is lying to us.,False,,0,1550243002.0,0,0,0,0,False,False,,52,0,,False,False,conspiracy,795126,0,1440,-1,75,15,14,6,8,1,1366,227,138,43,95,4
