post_score,is_original,post_title,post_archived,post_distinguished,post_downs,post_edited,post_gilded,post_gilded_silver,post_gilded_gold,post_gilded_platinum,post_is_original_content,post_is_video,post_likes,post_num_comments,post_num_crossposts,post_num_reports,post_over_18,post_pinned,subreddit,subreddit_subscribers,post_ups,posted_len_minutes,post_title_sentiment,post_title_characters,post_title_words,post_title_uniq_words,post_title_stop_words,post_title_non_stop_words,post_text_sentiment,post_text_characters,post_text_words,post_text_uniq_words,post_text_stop_words,post_text_non_stop_words,day_of_week
551,True,Bots are downvoting every single submission to this sub. Only 2 out of 18 submissions made in the past hour are above zero. Please come to new and upvote some quality submissions.,False,,0,False,0,0,0,0,False,False,,64,0,,False,False,conspiracy,795126,551,7200,-1,176,32,29,11,18,-1,783,137,97,34,63,4
104,True,Congressional Democrats join GOP lawmakers against Rep. Ilhan Omar because Omar suggested that Israeli money (AIPAC) influences US elections.,False,,0,False,0,0,0,0,False,False,,26,0,,False,False,conspiracy,795126,104,7200,0,137,19,18,3,15,0,0,0,0,0,0,4
18,True,Unite To Fight Together,False,,0,False,0,0,0,0,False,False,,5,0,,False,False,conspiracy,795126,18,7200,0,23,4,4,1,3,-1,526,96,67,24,43,4
6,True,NASA Sees Climate Cooling Trend Thanks to Low Sun Activity,False,,0,False,0,0,0,0,False,False,,13,1,,False,False,conspiracy,795126,6,7200,1,58,10,10,1,9,0,0,0,0,0,0,4
18,True,VACCINE INSANITY: Multiple strains of deadly pig virus discovered in Rotavirus oral vaccines with no legitimate reason for their use,False,,0,False,0,0,0,0,False,False,,7,0,,False,False,conspiracy,795126,18,7200,-1,131,20,20,6,14,0,0,0,0,0,0,4
7,True,Fish stick collusion? CNN story on Russian pollock in US school lunches cracks up Twitterati,False,,0,False,0,0,0,0,False,False,,3,0,,False,False,conspiracy,795126,7,7200,0,91,15,15,3,12,0,0,0,0,0,0,4
15,True,Elliott Abrams: The War Criminal Running US Policy in Venezuela,False,,0,False,0,0,0,0,False,False,,1,0,,False,False,conspiracy,795126,15,7200,-1,62,10,10,2,8,0,0,0,0,0,0,4
16,True,Photographer's Hand Blown Off By Police Grenade During Yellow Vest Protests,False,,0,False,0,0,0,0,False,False,,4,0,,False,False,conspiracy,795126,16,7200,0,75,12,12,4,8,0,0,0,0,0,0,4
4,True,The origin of AIDS,False,,0,False,0,0,0,0,False,False,,20,0,,False,False,conspiracy,795126,4,7200,0,18,4,4,2,2,1,670,125,96,33,63,4
133,True,Kamala Harris' A.G. Office Tried to Keep Inmates Locked Up for Cheap Labor,False,,0,False,0,0,0,0,False,False,,16,0,,False,False,conspiracy,795126,133,7200,1,72,14,14,4,10,0,0,0,0,0,0,4
62,True,Chuck Schumer is pro-choice in America and Pros-life in his home country of Israel.,False,,0,False,0,0,0,0,False,False,,30,0,,False,False,conspiracy,795126,62,7200,0,82,16,15,5,10,0,0,0,0,0,0,4
5,True,Applications Of HAARP - From U.S Navy Document,False,,0,False,0,0,0,0,False,False,,3,0,,False,False,conspiracy,795126,5,7200,0,44,8,8,3,5,0,0,0,0,0,0,4
0,True,"If you don't have 50+ vaccines before age 18, you'll die",False,,0,False,0,0,0,0,False,False,,29,0,,False,False,conspiracy,795126,0,7200,0,54,13,12,7,5,1,227,28,18,1,17,4
0,True,New FBI Anon,False,,0,False,0,0,0,0,False,False,,19,0,,False,False,conspiracy,795126,0,7200,1,12,3,3,0,3,0,0,0,0,0,0,4
50,True,"[OC] Psychopathy, the Keystone of the Grand Conspiracy. Understanding the nature of psychopathy and it's relationship with power means understanding the world today.",False,,0,False,0,1,0,0,False,False,,27,4,,False,False,conspiracy,795126,50,7200,1,160,24,18,6,12,1,10032,1674,698,100,598,4
3,True,Don't Panic! Lighten Up! Delegates at Davos Confirm....We Are All Peasants!!!,False,,0,False,0,0,0,0,False,False,,4,0,,False,False,conspiracy,795126,3,7200,0,69,13,13,7,6,0,0,0,0,0,0,4
6,True,Blue Drink conspiracy?,False,,0,False,0,0,0,0,False,False,,15,0,,False,False,conspiracy,795126,6,7200,0,21,3,3,0,3,1,431,81,61,23,38,4
0,True,"After a recent r/conspiracy post, i queried the G for ""minors right to vaccinate without parental consent"" and this brief from 10th result seemed odd... (SS for more)",False,,0,False,0,0,0,0,False,False,,5,0,,False,False,conspiracy,795126,0,7200,1,158,29,28,10,18,0,0,0,0,0,0,4
0,True,German court rules not enough proof to show measles is a virus. This brings up many questions.,False,,0,False,0,0,0,0,False,False,,6,0,,False,False,conspiracy,795126,0,7200,1,92,17,17,6,11,-1,622,119,84,37,47,4
39,True,"Is Skynet a reality? As Trump signs executive order on artificial intelligence, tech giants warn of danger",False,,0,False,0,0,0,0,False,False,,8,0,,False,False,conspiracy,795126,39,7200,-1,104,17,17,5,12,0,0,0,0,0,0,4
35,True,"Vaccine effectiveness numbers are exceptionally deceptive because they are derived from ""relative risks"" rather than ""absolute risks"".",False,,0,False,0,0,0,0,False,False,,8,0,,False,False,conspiracy,795126,35,7200,1,129,17,15,5,10,1,1444,250,143,42,101,4
36,True,You wanna see a real shit show in politics? Wait till the ‘minors right to vaccinate without parental consent’ legislation gets written as ‘medical procedures’ and people realize it is being funded by abortion groups.,False,,0,False,0,0,0,0,False,False,,24,0,,False,False,conspiracy,795126,36,7200,-1,211,36,36,11,25,1,53,10,10,4,6,4
7,True,Freshman Democratic Rep. Ilhan Omar accused of sending 'anti-Semitic' tweets! Omar has previously taken heat for her views regarding Israel.,False,,0,False,0,0,0,0,False,False,,7,0,,False,False,conspiracy,795126,7,7200,-1,135,21,20,4,16,0,0,0,0,0,0,4
200,True,"There’s been a big media push defending AIPAC after Ilhan Omar points out they have massive influence on American government policy, and twitter accounts are copy and pasting paragraphs from AIPAC’s website to defend the Israeli advocacy group",False,,0,False,0,0,0,0,False,False,,42,0,,False,False,conspiracy,795126,200,7200,0,242,40,37,14,23,0,0,0,0,0,0,4
0,True,"When A Flat Earther Destroys A Particle Physicist. I’m Not A Flat Earther, But This Was Downright Embarrassing For The Physicist",False,,0,False,0,0,0,0,False,False,,11,0,,False,False,conspiracy,795126,0,7200,-1,126,22,17,10,7,0,0,0,0,0,0,4
16,True,Lifting the Veil An Investigative History of the United States Pathocracy. [Editor's Note] Lifting the Veil is the best summary revealing the deepest levels of deception in our world we've seen.,False,,0,False,0,0,0,0,False,False,,13,1,,False,False,conspiracy,795126,16,7200,1,190,33,26,9,17,0,0,0,0,0,0,4
17,True,"10 requirements of the new green deal. Sounds a lot like “1984” meets “Atlas Shrugged.” Don’t worry, the government can take care of EVERYTHING.",False,,0,False,0,0,0,0,False,False,,14,0,,False,False,conspiracy,795126,17,7200,-1,136,25,23,6,17,0,0,0,0,0,0,4
0,True,"#439 The Sickness of Spielberg, Indiana Jones was a Pedo",False,,0,False,0,0,0,0,False,False,,6,0,,False,False,conspiracy,795126,0,7200,0,54,10,10,4,6,0,0,0,0,0,0,4
2,True,Is anti- anti-vax propaganda being used to distract from disease-carrying refugees?,False,,0,False,0,0,0,0,False,False,,9,1,,False,False,conspiracy,795126,2,7200,-1,81,13,12,4,8,1,543,100,74,27,47,4
16,True,Is Your Thinking Your Own? Or Someone Else's?,False,,0,False,0,0,0,0,False,False,,4,0,,False,False,conspiracy,795126,16,7200,1,43,9,8,5,3,0,0,0,0,0,0,4
2,True,FBI Testimonies on Carter Page FISA Reveal Broken Oversight Process,False,,0,False,0,0,0,0,False,False,,16,0,,False,False,conspiracy,795126,2,7200,-1,67,10,10,1,9,0,0,0,0,0,0,4
0,True,Semen Retention: The Elite's Biggest Secret,False,,0,False,0,0,0,0,False,False,,31,0,,False,False,conspiracy,795126,0,7200,-1,42,7,7,2,5,1,367,68,58,25,33,4
0,True,"""Ancient Earth rock found on the moon""",False,,0,False,0,0,0,0,False,False,,5,0,,False,False,conspiracy,795126,0,7200,0,36,7,7,2,5,1,407,77,61,19,42,4
164,True,AP Exclusive: Undercover Israeli spy exposed in NYC was 1 of many. Why is Israel allowed to run intelligence and espionage operations in the US with impunity?,False,,0,False,0,0,0,0,False,False,,34,0,,False,False,conspiracy,795126,164,7200,1,155,27,26,9,17,0,0,0,0,0,0,4
7,True,The Frozen Envelope that sent Patrick Ewing to New York: The Rigging of the 1985 NBA draft,False,,0,False,0,0,0,0,False,False,,2,0,,False,False,conspiracy,795126,7,7200,1,89,17,15,4,11,0,0,0,0,0,0,4
64,True,I uploaded a Bob Lazar documentary yesterday. Worked on it for a while.,False,,0,False,0,0,0,0,False,False,,16,0,,False,False,conspiracy,795126,64,7200,0,69,13,12,6,6,0,0,0,0,0,0,4
0,True,"Progressives always want to feel like they are saving the world, but that takes a lot of work. Instead they inflate a non-issue into one that ""is going to destroy the world"", then they propose some poorly thought out law or way of behaving they claim will solve the fake problem they invented.",False,,0,False,0,0,0,0,False,False,,15,0,,False,False,conspiracy,795126,0,7200,-1,287,54,43,15,28,0,0,0,0,0,0,4
3,True,I am very new to the conspiracy corner of the Internet and I am torn on all the space stuff.,False,,0,False,0,0,0,0,False,False,,24,0,,False,False,conspiracy,795126,3,7200,1,91,20,16,9,7,-1,609,128,81,39,42,4
0,True,Disney is behind the recent Vic Mignogna allegations because anime could be a threat to them in the future.,False,,0,False,0,0,0,0,False,False,,0,0,,False,False,conspiracy,795126,0,7200,-1,106,19,18,8,10,1,5892,1110,435,97,338,4
263,True,An answer to why Michael Jackson wasn't a pedophile,False,,0,False,0,1,0,0,False,False,,113,0,,False,False,conspiracy,795126,263,7200,0,51,10,10,6,4,1,17609,3170,995,113,882,4
3,True,50 Lincoln to Kennedy Coincidences... how many can you take before you start to smell a rat?,False,,0,False,0,0,0,0,False,False,,3,0,,False,False,conspiracy,795126,3,7200,1,88,17,15,6,9,0,0,0,0,0,0,4
5,True,Theoretical Physicist Michio Kaku on Cosmology,False,,0,False,0,0,0,0,False,False,,11,0,,False,False,conspiracy,795126,5,7200,0,46,6,6,1,5,0,0,0,0,0,0,4
11,True,To take on The Lobby,False,,0,False,0,0,0,0,False,False,,12,0,,False,False,conspiracy,795126,11,7200,0,20,5,5,3,2,0,0,0,0,0,0,4
0,True,How To Tell If Someone Is Controlled Opposition,False,,0,False,0,0,0,0,False,False,,8,0,,False,False,conspiracy,795126,0,7200,0,47,8,8,4,4,0,0,0,0,0,0,4
1,True,"Pro-Vaxxer Propaganda in Overdrive: Why is a non-story about ""rebellious"" Australian teenagers getting their vaccines #1 on /r/worldnews right now?",False,,0,False,0,0,0,0,False,False,,52,1,,False,False,conspiracy,795126,1,7200,1,141,23,23,8,15,1,1701,302,184,49,135,4
33,True,"Amazon Facial Recognition App Sets Off Alarm Bells — Jeff Bezos’ ties to the national security state through Amazon Web Services are formidable, but the triple-digit billionaire’s furnishing of surveillance tools to the police state are no less disturbing.",False,,0,False,0,0,0,0,False,False,,4,0,,False,False,conspiracy,795126,33,7200,-1,251,40,34,9,25,0,0,0,0,0,0,4
1,True,TAKE THIS VOTE AND SHOVE IT - An Action Plan!,False,,0,False,0,0,0,0,False,False,,10,0,,False,False,conspiracy,795126,1,7200,1,42,9,9,4,5,0,0,0,0,0,0,4
4,True,US Influence in Venezuela Is Part of a Two Centuries-old Imperial Plan. America has a history of interfering in Venezuelan affairs.,False,,0,False,0,0,0,0,False,False,,2,0,,False,False,conspiracy,795126,4,7200,1,129,22,19,5,14,0,0,0,0,0,0,4
10,True,The REAL Cost of the War of Terror,False,,0,False,0,0,0,0,False,False,,4,0,,False,False,conspiracy,795126,10,7200,1,34,8,6,2,4,0,0,0,0,0,0,4
6,True,YouTube announces it will no longer recommend conspiracy videos,False,,0,False,0,0,0,0,False,False,,6,0,,False,False,conspiracy,795126,6,7200,0,63,9,9,3,6,0,0,0,0,0,0,4
42,True,Congress Cashes in on Insider Trading,False,,0,False,0,0,0,0,False,False,,10,0,,False,False,conspiracy,795126,42,7200,0,37,6,6,2,4,0,0,0,0,0,0,4
0,True,"Top scientist resigns ""Global Warming is a Trillion Dollar Scam - it has corrupted many scientists. The global Warming scam is the greatest and most successful scientific fraud I have seen in my long life as a physicist""",False,,0,False,0,0,0,0,False,False,,74,0,,False,False,conspiracy,795126,0,7200,1,215,37,31,12,19,0,0,0,0,0,0,4
69,True,It's happening! Civil forfeiture in the US is doomed!,False,,0,False,0,0,0,0,False,False,,44,0,,False,False,conspiracy,795126,69,7200,0,51,10,10,5,5,-1,252,42,37,16,21,4
0,True,Greenpeace? good or bad,False,,0,False,0,0,0,0,False,False,,4,0,,False,False,conspiracy,795126,0,7200,1,22,4,4,1,3,1,74,16,13,5,8,4
8,True,ALTERNATIVE NEWS‘I Voted Numerous Times To Build A Barrier To Prevent Illegal Immigrants Coming In’ – Hillary Clinton,False,,0,False,0,0,0,0,False,False,,15,0,,False,False,conspiracy,795126,8,7200,-1,114,18,17,4,13,0,0,0,0,0,0,4
167,True,French police throw tear gas at medics during Yellow Vests protest.,False,,0,False,0,0,0,0,False,False,,25,0,,False,False,conspiracy,795126,167,7200,0,66,11,11,2,9,0,0,0,0,0,0,4
0,True,Top scientist resigns: 'global warming is a $trillions scam — it has corrupted many scientists',False,,0,False,0,0,0,0,False,False,,14,0,,False,False,conspiracy,795126,0,7200,1,89,14,14,4,10,0,0,0,0,0,0,4
13,True,Just a military exersize,False,,0,False,0,0,0,0,False,False,,9,0,,False,False,conspiracy,795126,13,7200,-1,24,4,4,2,2,-1,78,14,14,6,8,4
3,True,Planned Parenthood covers up child sex trafficking,False,,0,False,0,0,0,0,False,False,,17,0,,False,False,conspiracy,795126,3,7200,0,50,7,7,1,6,0,0,0,0,0,0,4
411,True,"Acclaimed musician Roger Waters calls on people to demonstrate in Australia to defend Julian Assange: ""WikiLeaks, helped expose to the world the hidden machinations of the real criminals in our society: the oligarchs.""",False,,0,False,0,0,0,0,False,False,,36,0,,False,False,conspiracy,795126,411,7200,1,212,33,27,6,21,0,0,0,0,0,0,4
121,True,Why are r/news and r/worldnews bashing Anti-Vaxxers every single day?,False,,0,False,0,0,0,0,False,False,,415,1,,False,False,conspiracy,795126,121,7200,-1,68,13,12,3,9,1,485,84,67,27,40,4
0,True,No Meta Traffic Analysis,False,,0,False,0,0,0,0,False,False,,91,0,,False,False,conspiracy,795126,0,7200,0,24,4,4,1,3,1,6749,1337,717,75,642,4
0,True,FAKING SPACE - Apollo & the Vacuum of Space,False,,0,False,0,0,0,0,False,False,,13,0,,False,False,conspiracy,795126,0,7200,-1,39,7,6,2,4,-1,527,98,68,27,41,4
8,True,Crypto Scandal – Is Quadriga A Ponzi Scheme?,False,,0,False,0,0,0,0,False,False,,15,0,,False,False,conspiracy,795126,8,7200,0,41,7,7,2,5,-1,1410,239,150,42,108,4
5168,True,"At least 10,000 people died in Tiananmen Square massacre",False,,0,False,0,0,0,0,False,False,,590,1,,False,False,conspiracy,795126,5168,7200,-1,56,10,10,2,8,0,0,0,0,0,0,4
14,True,For PizzaGate Skeptics,False,,0,False,0,0,0,0,False,False,,49,0,,False,False,conspiracy,795126,14,7200,0,22,3,3,1,2,0,0,0,0,0,0,4
3,True,Western Media Fall in Lockstep for Cheap Trump/Rubio Venezuela Aid PR Stunt,False,,0,False,0,0,0,0,False,False,,1,0,,False,False,conspiracy,795126,3,7200,1,75,13,13,2,11,0,0,0,0,0,0,4
2,True,Chemical attraction,False,,0,False,0,0,0,0,False,False,,11,0,,False,False,conspiracy,795126,2,7200,0,19,2,2,0,2,1,320,62,50,23,27,4
0,True,"Disney's Racism.... or the corporate social controversy paradigm, just proves the masses cant think for themselves.",False,,0,False,0,0,0,0,False,False,,33,0,,False,False,conspiracy,795126,0,7200,1,109,17,16,6,10,1,5427,980,417,79,338,4
10,True,Just a heads up for this weeks propaganda machine and sensationalized media. There's going to be a lot of talk about this murder in NY and the new abortion law.,False,,0,1549874403.0,0,0,0,0,False,False,,4,0,,False,False,conspiracy,795126,10,7200,1,158,31,28,14,14,1,3624,685,308,80,228,4
12,True,Reddit backlash over 'China tech funding',False,,0,False,0,0,0,0,False,False,,4,0,,False,False,conspiracy,795126,12,7200,0,39,6,6,1,5,0,0,0,0,0,0,4
86,True,Drain the Swamp? Really?,False,,0,1549931086.0,0,0,0,0,False,False,,124,0,,False,False,conspiracy,795126,86,7200,1,22,4,4,1,3,1,4404,734,378,61,317,4
52,True,Does anyone remember bunker 2019/2010 the elite in bunkers preparing for event?,False,,0,False,0,0,0,0,False,False,,58,0,,False,False,conspiracy,795126,52,7200,0,78,13,13,4,9,1,284,54,45,19,26,4
0,True,Best Pizzagate Documentary I've seen on the subject!,False,,0,1549868073.0,0,0,0,0,False,False,,4,0,,False,False,conspiracy,795126,0,7200,1,51,9,9,4,5,1,209,44,39,24,15,4
16,True,National Enquirer Insiders Confirm Michael Sanchez Leaked Amazon CEO Jeff Bezos' Photos.,False,,0,False,0,0,0,0,False,False,,3,0,,False,False,conspiracy,795126,16,7200,0,86,12,12,0,12,0,0,0,0,0,0,4
92,True,Las Vegas Shooter Stephen Paddock,False,,0,False,0,0,0,0,False,False,,54,0,,False,False,conspiracy,795126,92,7200,0,33,5,5,0,5,1,2731,510,256,69,187,4
9,True,TEAM 26: Interview with Sandy Hook Doctor (2015),False,,0,False,0,0,0,0,False,False,,3,0,,False,False,conspiracy,795126,9,7200,0,45,8,8,1,7,0,0,0,0,0,0,4
7,True,Instagram - The new stock Exchange,False,,0,False,0,0,0,0,False,False,,3,0,,False,False,conspiracy,795126,7,7200,1,32,5,5,1,4,0,0,0,0,0,0,4
113,True,"""Meteor"" hits Valencia, Venezuela during political turmoil...but I've never seen a meteorite make a U-turn before! video in link",False,,0,False,0,0,0,0,False,False,,62,0,,False,False,conspiracy,795126,113,7200,0,122,22,21,7,14,0,0,0,0,0,0,4
10,True,As if we needed futher confirmation that the entertainment industry is teeming with pedophiles.,False,,0,False,0,0,0,0,False,False,,3,0,,False,False,conspiracy,795126,10,7200,0,94,14,14,7,7,0,49,11,11,6,5,4
10,True,Guggenheim Targeted by Protesters for Accepting Money From Family With OxyContin Ties,False,,0,False,0,0,0,0,False,False,,2,0,,False,False,conspiracy,795126,10,7200,0,85,12,12,4,8,0,0,0,0,0,0,4
36,True,"Attempting to help its puppet Guaido, the CIA is trying to sneak weapons and ammunition into Venezuela under the guise of ""humanitarian aid."" Paul Craig Roberts recommended this article by Moon Of Alabama",False,,0,False,0,0,0,0,False,False,,7,0,,False,False,conspiracy,795126,36,7200,0,200,33,30,10,20,0,0,0,0,0,0,4
2,True,Grammys - Illuminati / MKUltra Programming,False,,0,1549861664.0,0,0,0,0,False,False,,3,0,,False,False,conspiracy,795126,2,7200,0,38,4,4,0,4,-1,2019,393,227,69,158,4
37,True,"""I came across a curious book, little known American researcher. He argues that in the age of 13 he stayed with family friends and their neighbor, astrophysicist. He worked for the U.S. government, deciphering the technology of the Nazi flying saucer, which was delivered in new Mexico since 1945.""",False,,0,False,0,0,0,0,False,False,,4,0,,False,False,conspiracy,795126,37,7200,-1,288,50,43,14,29,1,13228,2236,838,97,741,4
14,True,"Rape, Murder, & A Suspicious Suicide: Jailed ""Psychic Surgeon"" To Stars [Including Oprah, Clintons] Ran Gruesome Sex Slave Farms",False,,0,False,0,0,0,0,False,False,,7,0,,False,False,conspiracy,795126,14,7200,-1,118,18,18,2,16,0,0,0,0,0,0,4
3,True,How to Pitch a Hollywood Movie,False,,0,False,0,0,0,0,False,False,,9,0,,False,False,conspiracy,795126,3,7200,0,30,6,6,3,3,-1,555,102,66,26,40,4
20,True,Laptop camera light on at the same moment I confirmed a flight reservation,False,,0,False,0,0,0,0,False,False,,19,0,,False,False,conspiracy,795126,20,7200,1,74,13,13,6,7,-1,75,14,12,5,7,4
8,True,Corporate Shill Accounts,False,,0,False,0,0,0,0,False,False,,10,0,,False,False,conspiracy,795126,8,7200,0,24,3,3,0,3,1,1384,246,155,48,107,4
3,True,(UPDATE) While everyone is distracted.... the EMBED button is back?,False,,0,False,0,0,0,0,False,False,,2,0,,False,False,conspiracy,795126,3,7200,0,60,10,9,3,6,1,113,23,21,11,10,4
17,True,"""A Dubai Princess Vanishes. A Video Offers Alarming Clues"" Mary Robinson, the former president of Ireland and former United Nations High Commissioner for Human Rights used to show proof of life for the Princess. Robinson called her a “troubled young woman” with a “serious medical condition.”",False,,0,False,0,0,0,0,False,False,,2,0,,False,False,conspiracy,795126,17,7200,-1,282,46,37,8,29,0,0,0,0,0,0,4
11,True,Any good YouTube channels for anything conspiracy?,False,,0,False,0,0,0,0,False,False,,15,0,,False,False,conspiracy,795126,11,7200,1,49,7,7,2,5,1,231,43,35,16,19,4
55,True,Here is Part 1 to a 4 Part series about Pizzagate. Although part 3 is blocked worldwide,False,,0,False,0,0,0,0,False,False,,49,0,,False,False,conspiracy,795126,55,7200,0,86,17,14,5,9,1,199,43,38,22,16,4
13,True,There is a narrative that illegals commit less crimes than natives. This is a conspiracy to promote convenient lies for the party of the MSM. This narrative is false,False,,0,False,0,0,0,0,False,False,,26,0,,False,False,conspiracy,795126,13,7200,-1,163,29,23,10,13,1,673,118,73,12,61,4
33,True,"""A Dubai Princess Vanishes. A Video Offers Alarming Clues"" Mary Robinson, the former president of Ireland and former United Nations High Commissioner for Human Rights used to show proof of life for the princess. Robinson called her a “troubled young woman” with a “serious medical condition.” $$$",False,,0,False,0,0,0,0,False,False,,2,0,,False,False,conspiracy,795126,33,7200,-1,282,46,37,8,29,0,0,0,0,0,0,4
0,True,Earth to Trump: America Is Already A Socialist Country,False,,0,False,0,0,0,0,False,False,,40,0,,False,False,conspiracy,795126,0,7200,0,53,9,9,3,6,0,0,0,0,0,0,4
21,True,"Twenty one months later, some people are still expecting this guy to do something other than divert the public's attention.",False,,0,False,0,0,0,0,False,False,,12,0,,False,False,conspiracy,795126,21,7200,-1,121,21,21,9,12,0,0,0,0,0,0,4
0,True,What If There Were 42 Million at the Border?,False,,0,False,0,0,0,0,False,False,,73,0,,False,False,conspiracy,795126,0,7200,0,43,9,9,6,3,1,1778,327,176,52,124,4
29,True,What hit Venezuela was it a meteor or was it a missile?,False,,0,False,0,0,0,0,False,False,,42,0,,False,False,conspiracy,795126,29,7200,0,54,12,9,5,4,0,0,0,0,0,0,4
5,True,Everyone talks about the big conspiracies here but no one mentiones the lethal poisonous,False,,0,False,0,0,0,0,False,False,,4,0,,False,False,conspiracy,795126,5,7200,0,88,14,13,5,8,1,3016,545,240,60,180,4
17,True,"Why are the people or ""entities"" who run this planet are destroying it?",False,,0,False,0,0,0,0,False,False,,34,0,,False,False,conspiracy,795126,17,7200,-1,68,13,12,7,5,1,826,148,106,33,73,4
17,True,Those who don’t have the patience to question what they are told are one of the reasons we are manipulated by others,False,,0,False,0,0,0,0,False,False,,5,0,,False,False,conspiracy,795126,17,7200,0,116,23,20,13,7,-1,839,158,109,42,67,4
119,True,Fake News is a manufactured crisis to further restrict the freedom of the press,False,,0,False,0,0,0,0,False,False,,20,1,,False,False,conspiracy,795126,119,7200,-1,79,14,13,6,7,-1,426,83,61,28,33,4
0,True,Why some good 1980s & 1990s music singers are not famous?,False,,0,False,0,0,0,0,False,False,,5,0,,False,False,conspiracy,795126,0,7200,1,54,10,10,4,6,1,441,76,68,24,44,4
15,True,Do organic wheat foods have glysphosate (Monsanto round up)?,False,,0,1549849634.0,0,0,0,0,False,False,,20,0,,False,False,conspiracy,795126,15,7200,-1,57,9,9,3,6,1,970,174,116,40,76,4
109,True,CNN article about female candidates profiles every candidate except for Tulsi,False,,0,False,0,0,0,0,False,False,,27,0,,False,False,conspiracy,795126,109,7200,0,77,11,11,2,9,0,18,4,4,2,2,4
6,True,"Sex Abuse, Stanley Kubrick, and The Shining",False,,0,False,0,0,0,0,False,False,,3,0,,False,False,conspiracy,795126,6,7200,0,41,7,7,2,5,0,0,0,0,0,0,4
9,True,Breaking Down the Secrets of Eyes Wide Shut,False,,0,False,0,0,0,0,False,False,,3,0,,False,False,conspiracy,795126,9,7200,-1,43,8,8,3,5,0,0,0,0,0,0,4
6,True,Are These Real UFOs? You decide..,False,,0,False,0,0,0,0,False,False,,20,0,,False,False,conspiracy,795126,6,7200,1,30,6,6,3,3,1,331,68,57,26,31,4
12,True,What I still don't understand about Parkland,False,,0,1549901538.0,0,0,0,0,False,False,,5,0,,False,False,conspiracy,795126,12,7200,0,44,8,8,5,3,0,139,29,24,10,14,4
16,True,The Globalists want to take over the world for the benefit of the Globalist Fascist Oligarchy. Some articles that will help you gain the knowledge to fight back,False,,0,False,0,0,0,0,False,False,,2,0,,False,False,conspiracy,795126,16,7200,0,159,28,23,9,14,1,1201,217,138,46,92,4
32,True,Seeking Comfort in a Dysfunctional Society,False,,0,False,0,0,0,0,False,False,,34,0,,False,False,conspiracy,795126,32,7200,0,42,6,6,2,4,1,10960,2001,690,100,590,4
0,True,Did the Superbowl Halftime Show Foreshadow the recent Meteors in Latin America?,False,,0,False,0,0,0,0,False,False,,2,0,,False,False,conspiracy,795126,0,7200,0,78,12,11,3,8,0,0,0,0,0,0,4
3,True,Surely not EVERYONE in an Illuminati bloodline is connected?,False,,0,False,0,0,0,0,False,False,,3,0,,False,False,conspiracy,795126,3,7200,-1,59,9,9,4,5,1,367,73,54,25,29,4
11,True,Aggressive legal strategy used to cover crimes of paedophile ring,False,,0,False,0,0,0,0,False,False,,1,0,,False,False,conspiracy,795126,11,7200,1,65,10,10,2,8,1,83,17,17,10,7,4
41,True,"Police in the bay area have killed two men sleeping in their cars with "" guns on their lap "" in the past 4 years",False,,0,1549840419.0,0,0,0,0,False,False,,20,0,,False,False,conspiracy,795126,41,7200,-1,108,23,19,6,13,-1,533,105,79,30,49,4
73,True,"If you look at the trends of history, the United States is heading in the same direction as Nazi Germany.",False,,0,False,0,0,0,0,False,False,,54,0,,False,False,conspiracy,795126,73,7200,0,103,20,18,9,9,0,0,0,0,0,0,4
134,True,"So There's a ""Conspiracy Theory Network"" Forming That's Hosted Independently (meaning no admins deleting posts because it is challenging the narrative)",False,,0,False,0,0,0,0,False,False,,31,0,,False,False,conspiracy,795126,134,7200,1,147,23,22,10,12,0,0,0,0,0,0,4
63,True,Are there any modern bands today like Rage Against the Machine?,False,,0,False,0,0,0,0,False,False,,131,0,,False,False,conspiracy,795126,63,8640,1,62,11,11,5,6,1,316,61,48,19,29,4
