post_score,is_original,post_title,post_archived,post_distinguished,post_downs,post_edited,post_gilded,post_gilded_silver,post_gilded_gold,post_gilded_platinum,post_is_original_content,post_is_video,post_likes,post_num_comments,post_num_crossposts,post_num_reports,post_over_18,post_pinned,subreddit,subreddit_subscribers,post_ups,posted_len_minutes,post_title_sentiment,post_title_characters,post_title_words,post_title_uniq_words,post_title_stop_words,post_title_non_stop_words,post_text_sentiment,post_text_characters,post_text_words,post_text_uniq_words,post_text_stop_words,post_text_non_stop_words,day_of_week
8511,False,Does this description of the enemy still hold true?,False,,0,False,0,0,0,0,False,False,,443,1,,False,False,conspiracy,812675,8511,126720,1,50,9,9,4,5,0,0,0,0,0,0,2
8491,False,This is ACTUAL PROOF of Clintons selling favors to foreign governments during her time as SoS. Deleted from 4 subreddits already. /r/Conspiracy is my last bastion of hope.,True,,0,1510083005.0,0,0,0,0,False,False,,871,0,,False,False,conspiracy,812675,8491,1221120,-1,167,29,27,9,18,1,1339,259,174,58,116,2
8472,False,"@ggreenwald: ""Note how Sanders is going after Trump on what voters care about - SS & Medicare - rather than ranting about Putin & imaginary Kremlin plots""",True,,0,False,0,0,0,0,False,False,,969,0,,False,False,conspiracy,812675,8472,1128960,0,131,22,21,7,14,0,0,0,0,0,0,2
8476,False,Sacha Baron Cohen filmed a scene in 'Who is America' about pedophilia. What happened was so shocking that it was cut from the show. (Interview),False,,0,1545299366.0,2,0,2,0,False,False,,942,7,,False,False,conspiracy,812675,8476,100800,-1,137,25,24,12,12,-1,1979,394,182,57,125,2
8469,False,Project Veritas Caught by the Washington Post Running a Sting Operation to Discredit Roy Moore Pedophile Reporting,True,,0,False,0,0,0,0,False,False,,3662,0,,False,False,conspiracy,812675,8469,658080,0,114,17,17,4,13,0,0,0,0,0,0,2
8461,False,No words describe this,True,,0,False,0,0,0,0,False,False,,496,0,,False,False,conspiracy,812675,8461,790560,0,22,4,4,2,2,0,0,0,0,0,0,2
8449,False,"What Are The Odds?? Same Guy That Filmed France Truck Attack, On Scene at German Mall Shooting..",True,,0,False,0,0,0,0,False,False,,673,0,,False,False,conspiracy,812675,8449,1368000,0,91,17,17,7,10,-1,736,125,85,22,63,2
8451,False,"The repitition will remain: We have enough money for war, but feeding the poor is too over budget to accomplish apparently. We have enough money for 50 nukes to be launched, but not enough money to fix Flint's pipes. That alone should stir up suspicion-it's evident at this point they don't like us.",True,,0,False,1,0,1,0,False,False,,558,0,,False,False,conspiracy,812675,8451,907200,-1,293,57,45,22,23,0,0,0,0,0,0,2
8443,False,"700,000 Petition the US Government to Stop Monsanto-Bayer Merger",True,,0,False,0,0,0,0,False,False,,302,0,,False,False,conspiracy,812675,8443,1274400,0,64,11,11,2,9,0,0,0,0,0,0,2
8433,False,"Private Internet Access, a VPN provider, takes out a full page ad in The New York Time calling out 50 senators. (X-Post r/pics)",True,,0,False,0,0,0,0,False,False,,336,0,,False,False,conspiracy,812675,8433,1012320,1,122,25,23,4,19,0,0,0,0,0,0,2
8412,False,"If you find it hard to accept that people are actually murdered because they represent a threat to political and financial power holders, well, I'm 68 years old and I'd like to remind you that when I was a teenager the list of those murdered for such reasons included JFK, MLK, Malcolm X, and RFK.",True,,0,1495071049.0,0,0,0,0,False,False,,823,0,,False,False,conspiracy,812675,8412,937440,-1,291,57,47,20,27,1,596,111,77,34,43,2
8359,False,Google and YouTube caught actively censoring negative Clinton coverage.,True,,0,False,0,0,0,0,False,False,,466,0,,False,False,conspiracy,812675,8359,1225440,-1,70,9,9,1,8,0,0,0,0,0,0,2
8316,False,How an extra GPS tracker on a drug dealer's car unraveled a corrupt Baltimore police force that robbed homeless people and resold confiscated heroin and ecstasy back on the street,True,,0,False,0,0,0,0,False,False,,498,4,,False,False,conspiracy,812675,8316,475200,-1,179,31,28,8,20,0,0,0,0,0,0,2
8308,False,"Anthony Bourdain took Chantix to quit smoking, a drug that has more cases of suicidal thoughts, self-harm, and homicidal thoughts than any other drug, by a more than three-fold margin",True,,0,False,0,0,0,0,False,False,,964,2,,False,False,conspiracy,812675,8308,378720,1,179,32,27,11,16,0,0,0,0,0,0,2
8304,False,"In this age of 'Fake news', let's remember that the Media decides our reality.",True,,0,False,0,0,0,0,False,False,,398,0,,False,False,conspiracy,812675,8304,1159200,-1,74,15,15,7,8,0,0,0,0,0,0,2
8300,False,"FYI the man Trump is considering for National Security Adviser (John R. Bolton) was sworn into this position on May 11, 2001 and is the central part of the 'WMDs in Iraq' claims Bush made. This man is evil.",True,,0,False,0,0,0,0,False,False,,707,1,,False,False,conspiracy,812675,8300,502560,-1,198,39,33,10,23,0,0,0,0,0,0,2
8277,False,I recommend no chargers.,True,,0,False,0,0,0,0,False,False,,239,0,,False,False,conspiracy,812675,8277,1382400,0,23,4,4,2,2,0,0,0,0,0,0,2
8266,False,"NY pension chief invests $100 million into controversial gas company, then immediately retires, and takes $300k part time job with said company",False,,0,False,0,0,0,0,False,False,,348,3,,False,False,conspiracy,812675,8266,224640,1,139,22,21,4,17,0,0,0,0,0,0,2
8253,False,"Trump just tweeted: ""Subject to the receipt of further information, I will be allowing, as President, the long blocked and classified JFK FILES to be opened.""",True,,0,False,0,0,0,0,False,False,,1956,0,,False,False,conspiracy,812675,8253,712800,-1,151,26,23,10,13,0,0,0,0,0,0,2
8250,False,When you own the media,True,,0,False,0,0,0,0,False,False,,432,0,,False,False,conspiracy,812675,8250,1565280,1,22,5,5,4,1,0,0,0,0,0,0,2
8191,False,"FBI recommends no charges against Clinton, but Snowden & others didn’t get off so easy",True,,0,False,0,0,0,0,False,False,,488,0,,False,False,conspiracy,812675,8191,1392480,1,83,15,15,7,8,0,0,0,0,0,0,2
8189,False,"In Leaked Speech, Clinton Promises Bankers to Stand Against Pot Legalization 'In All Senses of the Word'",True,,0,False,0,0,0,0,False,False,,804,0,,False,False,conspiracy,812675,8189,1252800,0,101,17,16,6,10,0,0,0,0,0,0,2
8142,False,FBI re-opens Hillary email investigation!,True,,0,False,0,0,0,0,False,False,,852,0,,False,False,conspiracy,812675,8142,1228320,0,40,6,6,1,5,0,0,0,0,0,0,2
8122,False,"Nestle CEO: Water Is Not A Human Right, Should Be Privatized",True,,0,False,0,0,0,0,False,False,,641,0,,False,False,conspiracy,812675,8122,1825920,1,58,11,11,5,6,0,0,0,0,0,0,2
8083,False,"Cops Who Flash Banged Infant's Crib Are Blaming the Baby in Court, state; ""The act of sleeping in a room about to be breached by a SWAT team constituted “criminal” conduct on the part of the infant.""",True,,0,False,0,0,0,0,False,False,,684,1,,False,False,conspiracy,812675,8083,1985760,-1,192,38,31,12,19,0,0,0,0,0,0,2
8061,False,Fairness of justice system in America,True,,0,False,0,0,0,0,False,False,,298,2,,False,False,conspiracy,812675,8061,398880,0,37,6,6,2,4,0,0,0,0,0,0,2
8029,False,Three Anti-Clinton Officials Found Dead In One Month,True,,0,False,0,0,0,0,False,False,,428,0,,False,False,conspiracy,812675,8029,1347840,-1,52,9,9,1,8,0,0,0,0,0,0,2
8014,False,Apple and Samsung fined for deliberately slowing down older phones.,False,,0,False,0,0,0,0,False,False,,539,2,,False,False,conspiracy,812675,8014,145440,1,66,10,10,3,7,0,0,0,0,0,0,2
8015,False,New Poll Shows 60% of Americans Think Hillary Clinton is Untrustworthy and Dishonest,True,,0,False,0,0,0,0,False,False,,828,0,,False,False,conspiracy,812675,8015,1740960,-1,83,13,13,3,10,0,0,0,0,0,0,2
8011,False,Rep. Tulsi Gabbard Introduces Bill to Permanently End Warrantless Collection of Americans’ Emails,True,,0,False,0,0,0,0,False,False,,380,0,,False,False,conspiracy,812675,8011,930240,0,95,13,13,2,11,0,0,0,0,0,0,2
7995,False,Amazon deletes one-star reviews of Hillary Clinton's new book,True,,0,False,0,0,0,0,False,False,,834,0,,False,False,conspiracy,812675,7995,767520,1,61,11,11,2,9,0,0,0,0,0,0,2
7912,False,"Thanks a lot asshole: With only days remaining in office, Obama announced new rules that will let the NSA share private data gathered without warrant, court orders or congressional authorization with 16 other agencies, including the FBI, DEA and DHS.",True,,0,False,0,0,0,0,False,False,,732,0,,False,False,conspiracy,812675,7912,1114560,1,244,40,38,10,28,0,0,0,0,0,0,2
7903,False,Feminist who tortured a man for 15-20 days and was sentenced to 25 years in prison was speaker at the 'Womens March'. MSM is praising her.,True,,0,False,0,0,0,0,False,False,,1650,0,,False,False,conspiracy,812675,7903,1103040,0,134,27,26,11,15,0,0,0,0,0,0,2
7869,False,Amazon Made $5.6 Billion in Profits Last Year and Reportedly Paid Zero American Dollars in Federal Taxes,True,,0,False,0,0,0,0,False,False,,448,0,,False,False,conspiracy,812675,7869,527040,0,103,18,17,2,15,0,0,0,0,0,0,2
7853,False,This video is being mass downvoted all over Reddit and has been removed from conspiracy once already! Somebody doesn't want the world to know the Paris riots are getting out of control!,False,,0,False,0,3,0,1,False,False,,1464,8,,False,False,conspiracy,812675,7853,122400,0,183,33,32,17,15,0,0,0,0,0,0,2
7846,False,"Here's the censored CBS clip where Bill Clinton says Hillary faints frequently. If you're unaware, the media has edited it out of the interview... #StreisandEffect",True,,0,False,0,0,0,0,False,False,,461,0,,False,False,conspiracy,812675,7846,1291680,1,157,27,25,11,14,0,0,0,0,0,0,2
7828,False,"Woman Dragged Out of West Virginia House Hearing For Listing Oil and Gas Contributions to Members — ""The people who are going to be speaking in favor of this bill are all going to be paid by the industry.""",True,,0,False,0,0,0,0,False,False,,361,1,,False,False,conspiracy,812675,7828,548640,0,200,38,31,13,18,0,0,0,0,0,0,2
7819,False,John Lennon,True,,0,False,0,0,0,0,False,False,,650,0,,False,False,conspiracy,812675,7819,1085760,0,11,2,2,0,2,0,0,0,0,0,0,2
7806,False,"18 CEOs Called Out By Bernie Sanders For Taking Trillions In Bailouts, Evading Taxes, And Outsourcing Jobs",True,,0,False,0,0,0,0,False,False,,538,0,,False,False,conspiracy,812675,7806,1864800,0,104,17,17,5,12,0,0,0,0,0,0,2
7785,False,An online petition to arrest Bill Clinton for allegedly violating election laws has received almost 80 thousand signatures in less than 24 hours,True,,0,False,0,0,0,0,False,False,,670,0,,False,False,conspiracy,812675,7785,1572480,-1,144,23,23,6,17,0,0,0,0,0,0,2
7777,False,"Stop ""resisting""",True,,0,False,1,0,1,0,False,False,,1119,0,,True,False,conspiracy,812675,7777,1620000,0,14,2,2,0,2,0,0,0,0,0,0,2
7712,False,Almost 70 years and nothing has changed.,True,,0,False,0,0,0,0,False,False,,266,0,,False,False,conspiracy,812675,7712,2410560,0,39,7,7,2,5,0,0,0,0,0,0,2
7708,False,"Petition to remove Ellen Pao as CEO gains 100,000+ signatures in less than 24hrs. Links reporting this news are removed or censored on r/news.",True,,0,False,0,0,0,0,False,False,,375,0,,False,False,conspiracy,812675,7708,1919520,-1,139,26,25,8,17,0,0,0,0,0,0,2
7688,False,"To learn how the Federal Reserve Bank works, refer to Rule #11 of Monopoly.",False,,0,False,0,0,0,0,False,False,,519,4,,False,False,conspiracy,812675,7688,256320,0,72,14,13,4,9,0,0,0,0,0,0,2
7675,False,Guccifer 2.0 Hacked Clinton Foundation,True,,0,False,0,0,0,0,False,False,,766,0,,False,False,conspiracy,812675,7675,1262880,0,38,6,6,0,6,0,0,0,0,0,0,2
7675,False,"Hi, my name is Rose Cherami. I was a drug courier for Jack Ruby. On 11-21-1963, I warned state police and hospital staff that J.F.K. would be killed in Dallas. My story was passed onto the Dallas PD and ignored, and in 1965 I was found dead on a lonely stretch of road in Texas.",True,,0,False,0,0,0,0,False,False,,414,0,,False,False,conspiracy,812675,7675,1029600,1,270,59,47,13,34,0,0,0,0,0,0,2
7672,False,It Makes you think a little......,True,,0,False,1,0,1,0,False,False,,565,0,,False,False,conspiracy,812675,7672,1605600,-1,27,6,6,3,3,0,0,0,0,0,0,2
7659,False,"Sky News abruptly end interview with the former commander of British Armed Forces in Iraq after he goes off-script, questions why Assad would launch a chemical attack despite the fact he's winning the war, and so soon after Trump discussed leaving Syria",True,,0,False,0,0,0,0,False,False,,622,2,,False,False,conspiracy,812675,7659,462240,1,251,44,40,12,28,0,0,0,0,0,0,2
7652,False,Whistleblower John Bolenbaugh shows oil spills in Michigan were hidden instead of cleaned up,True,,0,False,1,0,1,0,False,False,,189,0,,False,False,conspiracy,812675,7652,1071360,-1,92,14,14,4,10,0,0,0,0,0,0,2
7603,False,"Elon Musk shits on Corporate Media. Says he's wants to create botproof website where the public can rate the core truth of any article & track the credibility score over time of each journalist, editor & publication.",True,,0,1527131400.0,0,0,0,0,False,False,,494,2,,False,False,conspiracy,812675,7603,403200,1,209,36,33,11,22,1,3257,565,320,73,247,2
7591,False,Leaked DNC emails conclusively prove that Hillary Clinton colluded with the Democratic party in order to rig the election and ensure Bernie Sanders would not win the nomination,True,,0,False,0,0,0,0,False,False,,480,0,,False,False,conspiracy,812675,7591,1416960,-1,176,28,26,7,19,0,0,0,0,0,0,2
7524,False,Illegal,True,,0,False,0,0,0,0,False,False,,176,0,,False,False,conspiracy,812675,7524,2191680,-1,7,1,1,0,1,0,0,0,0,0,0,2
7526,False,Panama Papers,False,,0,False,0,0,0,0,False,False,,316,0,,False,False,conspiracy,812675,7526,118080,0,13,2,2,0,2,0,0,0,0,0,0,2
7442,False,"In 2009, DynCorp employees hired a 15-year-old boy to strip dance for them. Hillary Clinton covered this up because she received money from DynCorp. This was revealed yesterday through WikiLeaks, yet no mainstream media is covering this.",True,,0,False,0,0,0,0,False,False,,420,0,,False,False,conspiracy,812675,7442,1215360,1,232,39,36,14,22,0,0,0,0,0,0,2
7442,False,The creator of Reddit Secret Santa has been removed from the subreddit he started (and fired from his job) for voicing concerns over Reddit's leadership.,True,,0,False,0,0,0,0,False,False,,212,0,,False,False,conspiracy,812675,7442,1923840,-1,150,26,23,11,12,0,0,0,0,0,0,2
7371,False,Reddit removes Anthony Weiner Pizzagate post from 4th position on r/all,True,,0,False,0,0,0,0,False,False,,1533,0,,False,False,conspiracy,812675,7371,1090080,0,71,12,12,3,9,0,0,0,0,0,0,2
7363,False,America is fed a different story than the rest of the world,True,,0,False,0,0,0,0,False,False,,544,0,,False,False,conspiracy,812675,7363,933120,0,59,12,11,5,6,0,0,0,0,0,0,2
7320,False,"Wikileaks offering $100,000 to anyone who releases the rest of the JFK files.",True,,0,False,0,0,0,0,False,False,,620,0,,False,False,conspiracy,812675,7320,704160,0,75,14,13,4,9,0,0,0,0,0,0,2
7308,False,Did you know that before 1973 it was illegal in the US to profit off of health care. The Health Maintenance Organization Act of 1973 passed by Nixon changed everything.,True,,0,False,1,0,1,0,False,False,,715,0,,False,False,conspiracy,812675,7308,1028160,-1,166,30,26,12,14,1,244,50,38,17,21,2
7302,False,HOURLY REMINDER: the CIA must be dismantled immediately in the interests of national security.,True,,0,False,0,0,0,0,False,False,,827,0,,False,False,conspiracy,812675,7302,1039680,0,92,14,13,4,9,0,0,0,0,0,0,2
7285,False,"Wikileaks: In honor of Martin Luther King Day, here's the 17,000 page FBI file and the assassination trial transcript",True,,0,False,0,0,0,0,False,False,,517,0,,False,False,conspiracy,812675,7285,1113120,0,115,21,20,6,14,0,0,0,0,0,0,2
7257,False,Welcome to the news,False,,0,False,0,0,0,0,False,False,,231,1,,False,False,conspiracy,812675,7257,257760,1,19,4,4,2,2,0,0,0,0,0,0,2
7245,False,Hillary’s ‘Candidacy would Collapse’ If Voters knew the Clinton Foundation pays Women 38% Less than Men says Gingrich,True,,0,False,0,0,0,0,False,False,,372,0,,False,False,conspiracy,812675,7245,1362240,-1,114,19,19,4,15,0,0,0,0,0,0,2
7243,False,Ten. Trillion,True,,0,False,0,0,0,0,False,False,,420,0,,False,False,conspiracy,812675,7243,881280,0,12,2,2,0,2,0,0,0,0,0,0,2
7246,False,"US Intervention, Before and After",True,,0,False,0,0,0,0,False,False,,891,0,,False,False,conspiracy,812675,7246,1179360,0,32,5,5,3,2,0,0,0,0,0,0,2
7215,False,"Do you guys remember during the election cycle when someone here found Hilary Clinton's IT guy posting on reddit trying to figure out how to ""fully wipe"" an email server? Your work resulted in a SUBPOENA BY CONGRESS and a mention during a James Comey (head of FBI) hearing!",True,,0,False,0,0,0,0,False,False,,622,0,,False,False,conspiracy,812675,7215,1023840,0,267,50,46,19,27,0,0,0,0,0,0,2
7212,False,Jill Stein on Latest WikiLeaks Reveal: How Much More Evidence Does Government Need to Press Charges Against Hillary Clinton?,True,,0,False,0,0,0,0,False,False,,968,0,,False,False,conspiracy,812675,7212,1241280,1,122,19,19,6,13,0,0,0,0,0,0,2
7191,False,13 year old chosen as one of the sexiest actresses. Sick Hollywood scum...,True,,0,False,0,0,0,0,False,False,,1145,1,,False,False,conspiracy,812675,7191,692640,-1,70,13,13,3,10,0,0,0,0,0,0,2
7154,False,"'This Needs to Happen All Over America': Applause for Candidate Who Called Out Big Oil Donors — ""Why do we need campaign finance reform? This. This is why.""",True,,0,False,0,0,0,0,False,False,,227,1,,False,False,conspiracy,812675,7154,547200,0,146,27,24,11,13,0,0,0,0,0,0,2
7148,False,"CTR bot ""hil4prez"" caught malfunctioning on /r/politics",True,,0,False,0,0,0,0,False,False,,520,0,,False,False,conspiracy,812675,7148,1205280,0,52,8,8,1,7,0,0,0,0,0,0,2
7125,False,"Julian Assange accused Google of Working With Hillary Campaign, Turns Out Their CEO Absolutely Does",True,,0,False,0,0,0,0,False,False,,196,0,,False,False,conspiracy,812675,7125,1334880,1,98,15,15,5,10,0,0,0,0,0,0,2
7093,False,34 percent of Americans polled by Bloomberg Politics believe this upcoming election is rigged,True,,0,False,0,0,0,0,False,False,,531,0,,False,False,conspiracy,812675,7093,1342080,0,93,14,14,4,10,0,0,0,0,0,0,2
7081,False,"Millennials Didn’t Kill the Economy. The Economy Killed Millennials.: The American system has thrown them into debt, depressed their wages, kept them from buying homes—and then blamed them for everything.",False,,0,False,0,1,0,0,False,False,,974,1,,False,False,conspiracy,812675,7081,119520,-1,198,32,26,11,15,0,0,0,0,0,0,2
7063,False,"Hillary Clintons entire campaign was run on fake news: staged photo ops, rigged debates, puppet journalists and scripted lines",True,,0,False,0,0,0,0,False,False,,987,0,,False,False,conspiracy,812675,7063,1153440,-1,123,19,19,3,16,0,0,0,0,0,0,2
7062,False,Whenever there's the idea of left versus right I always think back to this quote by Noam Chomsky.,True,,0,False,0,0,0,0,False,False,,515,0,,False,False,conspiracy,812675,7062,822240,1,96,19,19,8,11,0,0,0,0,0,0,2
7040,False,"Nestle bottles millions of litres of Canadian water — and pays nothing - Billion-dollar company extracting B.C.’s drinking water for free, then selling it back to Canadians",True,,0,False,0,0,0,0,False,False,,347,0,,False,False,conspiracy,812675,7040,760320,1,166,28,26,7,19,0,0,0,0,0,0,2
7011,False,"While Clinton Hid Emails, $6 Billion Went Missing in Her State Dept. ~ The Clinton State Dept. had a vacancy for the critical Inspector General position responsible for oversight and department spending, during the entire 5 year tenure of Hillary Clinton there.",True,,0,False,0,0,0,0,False,False,,252,0,,False,False,conspiracy,812675,7011,1372320,1,253,41,34,11,23,0,0,0,0,0,0,2
7009,False,How Reddit Was Destroyed (ver3.0),True,,0,1427561440.0,3,0,3,0,False,False,,827,1,,False,False,conspiracy,812675,7009,2067840,0,31,6,6,2,4,1,10904,2004,783,104,679,2
6992,False,Hillary Clinton is ....,True,,0,False,0,0,0,0,False,False,,559,0,,False,False,conspiracy,812675,6992,1332000,0,18,3,3,1,2,0,0,0,0,0,0,2
6990,False,Wife Of FBI Official Probing Clinton Emails Got $675K In Donations From Dems,True,,0,False,0,0,0,0,False,False,,294,0,,False,False,conspiracy,812675,6990,1229760,0,75,13,13,3,10,0,0,0,0,0,0,2
6887,False,Rothschild Family Wealth Is Five Times That Of World's Top 8 Billionaires Combined,True,,0,False,0,0,0,0,False,False,,1044,0,,False,False,conspiracy,812675,6887,1105920,1,82,14,14,4,10,0,0,0,0,0,0,2
6887,False,"Glenn Greenwald: ""The way the US media calls every rich Russian an ""oligarch"" but never uses that term for US billionaires is extremely revealing about how they propagandize for nationalistic purposes.""",False,,0,False,0,0,0,0,False,False,,502,2,,False,False,conspiracy,812675,6887,70560,1,196,31,28,9,19,0,0,0,0,0,0,2
6825,False,Opioid Deaths Plummeting in States with Legal Weed,True,,0,False,0,0,0,0,False,False,,377,0,,False,False,conspiracy,812675,6825,1008000,1,50,8,8,2,6,0,0,0,0,0,0,2
6825,False,Remember when Obama was anti-war?,True,,0,False,0,0,0,0,False,False,,993,0,,False,False,conspiracy,812675,6825,1183680,0,32,6,6,2,4,0,0,0,0,0,0,2
6795,False,Bernie Sanders - We Need to Stop Imprisoning People for Smoking Cannabis and Start Prosecuting the Crooks on Wall Street Whose Greed Caused the Greatest Economic Downturn Since the Great Depression,True,,0,False,0,0,0,0,False,False,,777,0,,False,False,conspiracy,812675,6795,401760,1,195,30,28,6,22,0,0,0,0,0,0,2
6792,False,Oswald was CIA and no one cares,True,,0,False,0,0,0,0,False,False,,759,0,,False,False,conspiracy,812675,6792,705600,0,31,7,7,3,4,0,0,0,0,0,0,2
6745,False,CIA Officer: Clinton Lost Because She Defrauded Bernie Sanders,True,,0,False,0,0,0,0,False,False,,1227,0,,False,False,conspiracy,812675,6745,1117440,0,61,9,9,2,7,0,0,0,0,0,0,2
6709,False,One of the most disgusting photos of all time,True,,0,False,0,0,0,0,False,False,,1055,0,,False,False,conspiracy,812675,6709,1048320,-1,45,9,8,4,4,0,0,0,0,0,0,2
6710,False,"63% of gun deaths are by suicide, yet we focus on mass shootings (at 1.5%) being the reason why we need more strict gun laws... Like Joe Rogan said, This country has a mental health problem disguised as a gun problem.",True,,0,False,0,0,0,0,False,False,,974,0,,False,False,conspiracy,812675,6710,1703520,1,207,42,37,14,23,0,0,0,0,0,0,2
6690,False,"People are not that ignorant, as it seems :)",True,,0,False,0,0,0,0,False,False,,178,0,,False,False,conspiracy,812675,6690,2066400,0,40,8,8,5,3,0,0,0,0,0,0,2
6680,False,Still true today,False,,0,False,0,0,0,0,False,False,,378,1,,False,False,conspiracy,812675,6680,243360,1,16,3,3,0,3,0,0,0,0,0,0,2
6677,False,London Underground Warning Signs (/r/pics),True,,0,False,0,0,0,0,False,False,,270,0,,False,False,conspiracy,812675,6677,1008000,0,39,6,6,0,6,0,0,0,0,0,0,2
6620,False,"Damn I miss Ron Paul, he is so right on Syria.",True,,0,False,1,0,1,0,False,False,,745,0,,False,False,conspiracy,812675,6620,996480,1,44,11,11,5,6,0,0,0,0,0,0,2
6606,False,"REMINDER: The University of Alaska Fairbanks is set to release its $300,000 computer model of Building 7. This finite element analysis of the 3rd tower collapse on 9/11 has exposed the official NIST report as fraudulent. UAF's 2 year project is banned from /r/engineering, /r/physics, and /r/science",True,,0,False,0,0,0,0,False,False,,684,0,,False,False,conspiracy,812675,6606,1054080,0,290,53,46,12,34,0,0,0,0,0,0,2
6601,False,"Wikileaks, in 10 years produced 10 million documents with 100% accuracy. How does that compare to NBC, CBS, ABC, CNN, Fox, MSNBC, Washington Post, New York Times etc.?",True,,0,False,0,0,0,0,False,False,,297,0,,False,False,conspiracy,812675,6601,1215360,1,155,28,27,6,21,0,0,0,0,0,0,2
6597,False,burger king just publicly confirmed police deleted security footage from Chicago police shooting,True,,0,False,0,0,0,0,False,False,,546,0,,False,False,conspiracy,812675,6597,1715040,1,96,13,12,2,10,0,0,0,0,0,0,2
6589,False,Fellow /r/conspiracy community: I propose we add the DNC's 'Hillary for 2016' collusion to the list of confirmed conspiracies.,True,,0,False,1,0,1,0,False,False,,300,0,,False,False,conspiracy,812675,6589,1353600,1,121,21,20,7,13,-1,350,62,47,19,28,2
6589,False,"Censored from #1 on /r/all due to non-existent ""paywall""; ""TIL Mark Zuckerberg was sued by 3 reporters from the Crimson, after Zuckerberg hacked into their email accounts to monitor the investigation against him. He used their invalid logins on facebook.com, to zero in on their email passwords.""",True,,0,False,0,0,0,0,False,False,,224,6,,False,False,conspiracy,812675,6589,469440,-1,285,50,40,14,26,0,0,0,0,0,0,2
6577,False,"Anonymous member receives FBI investigation documents from a whistleblower that show that the CIA was responsible for the 2001 anthrax attacks, which was a a psyop to fuel public terror and build support for the Iraq War. He's subsequently arrested on child porn charges and tortured by the FBI.",True,,0,False,0,0,0,0,False,False,,592,0,,False,False,conspiracy,812675,6577,2072160,1,292,50,40,13,27,0,0,0,0,0,0,2
6575,False,"Why is it easier to blame 150,000,000 Americans being 'lazy' rather than 400 Americans being greedy.",True,,0,False,0,0,0,0,False,False,,605,2,,False,False,conspiracy,812675,6575,642240,-1,97,18,15,6,9,0,0,0,0,0,0,2
6554,False,/u/Fluck needs gold for this,True,,0,False,0,0,0,0,False,False,,698,0,,False,False,conspiracy,812675,6554,2894400,0,27,6,6,2,4,0,0,0,0,0,0,2
6550,False,If only more people realized this.,True,,0,False,0,0,0,0,False,False,,219,0,,False,False,conspiracy,812675,6550,2208960,1,33,6,6,4,2,0,0,0,0,0,0,2
6546,False,Latest Guccifer 2.0 Leak Reaffirms Primaries Were Rigged for Clinton,True,,0,False,0,0,0,0,False,False,,436,0,,False,False,conspiracy,812675,6546,1373760,1,68,11,11,2,9,0,0,0,0,0,0,2
