post_score,is_original,post_title,post_archived,post_distinguished,post_downs,post_edited,post_gilded,post_gilded_silver,post_gilded_gold,post_gilded_platinum,post_is_original_content,post_is_video,post_likes,post_num_comments,post_num_crossposts,post_num_reports,post_over_18,post_pinned,subreddit,subreddit_subscribers,post_ups,posted_len_minutes,post_title_sentiment,post_title_characters,post_title_words,post_title_uniq_words,post_title_stop_words,post_title_non_stop_words,post_text_sentiment,post_text_characters,post_text_words,post_text_uniq_words,post_text_stop_words,post_text_non_stop_words,day_of_week
87,True,"SDSU Medical Anthropologist Explores 'Vaccine Hesitancy' and finds that vaccine hesitant parents are highly educated about vaccines and over-all, and also take more interest in their children's health than parents who don't question vaccines.",False,,0,False,0,0,0,0,False,False,,20,0,,False,False,conspiracy,795126,87,2880,1,238,37,32,14,18,0,0,0,0,0,0,4
121,True,Does chuck e cheese recycle pizzas? Any chuck e cheese employees who can fill us in? Spread the word. If you know a chuck e cheese employee link them here please. Let's end this once and for all.,False,,0,False,0,0,0,0,False,False,,238,0,,False,False,conspiracy,795126,121,2880,0,190,39,33,17,16,0,0,0,0,0,0,4
0,True,"#388 NASA and Mass Hypnosis, (A small lie from man a giant leap for mind...",False,,0,False,0,0,0,0,False,False,,10,0,,False,False,conspiracy,795126,0,2880,-1,69,15,14,4,10,0,0,0,0,0,0,4
7,True,"China Wants Reddit, and So Much More | US China | China Uncensored",False,,0,False,0,0,0,0,False,False,,2,0,,False,False,conspiracy,795126,7,2880,1,61,11,9,3,6,1,70,12,12,5,7,4
2,True,All the climate change deniers need to read this.,False,,0,False,0,0,0,0,False,False,,39,0,,False,False,conspiracy,795126,2,2880,0,48,9,9,4,5,0,0,0,0,0,0,4
27,True,Bill Burr discusses TPTB & microchipping.,False,,0,False,0,0,0,0,False,False,,11,0,,False,False,conspiracy,795126,27,2880,0,38,5,5,0,5,0,0,0,0,0,0,4
12,True,Feeling hopeless in a world run by evil,False,,0,False,0,0,0,0,False,False,,37,0,,False,False,conspiracy,795126,12,2880,-1,39,8,8,3,5,-1,611,118,90,44,46,4
17,True,Pedophiles Run America,False,,0,False,0,0,0,0,False,False,,4,0,,False,False,conspiracy,795126,17,2880,0,22,3,3,0,3,0,0,0,0,0,0,4
4,True,Lyndon LaRouche: great Presidential candidate? Or the greatest Presidential candidate??,False,,0,False,0,0,0,0,False,False,,2,0,,False,False,conspiracy,795126,4,2880,1,83,10,8,2,6,0,0,0,0,0,0,4
6,True,Antifa Still Have a Patreon Account,False,,0,1550101146.0,0,0,0,0,False,False,,21,0,,False,False,conspiracy,795126,6,2880,0,35,6,6,2,4,1,281,47,40,17,23,4
0,True,"2pac was an agent part of an intelligence program. Project Janus. Cointelpro were not after him, but monitoring and guiding him. A tough one many 2pac fans will dismiss.",False,,0,False,0,0,0,0,False,False,,6,0,,False,False,conspiracy,795126,0,2880,1,164,29,26,11,15,0,0,0,0,0,0,4
0,True,Why the New Green Deal is Dumb and Impossible #AOC,False,,0,False,0,0,0,0,False,False,,4,0,,False,False,conspiracy,795126,0,2880,-1,49,10,10,4,6,0,0,0,0,0,0,4
289,True,Media Erasing Tulsi Gabbard From Presidential Campaign,False,,0,False,0,0,0,0,False,False,,130,1,,False,False,conspiracy,795126,289,2880,0,54,7,7,1,6,0,0,0,0,0,0,4
8,True,XPost from What Would Reddit Look Like W/O Mods...the levels of censorship!,False,,0,False,0,0,0,0,False,False,,2,0,,False,False,conspiracy,795126,8,2880,0,72,14,14,5,9,0,0,0,0,0,0,4
60,True,My phone knows me a little too well.,False,,0,False,0,0,0,0,False,False,,59,0,,False,False,conspiracy,795126,60,2880,-1,35,8,8,4,4,1,358,74,49,25,24,4
0,True,Help!! Current conspiracy news wanted!,False,,0,False,0,0,0,0,False,False,,7,0,,False,False,conspiracy,795126,0,2880,0,35,5,5,0,5,1,104,16,15,5,10,4
35,True,"High Ranking US Military Officers Question 9/11 Official Story, Say Inside Job",False,,0,False,0,0,0,0,False,False,,5,0,,False,False,conspiracy,795126,35,2880,1,77,13,13,0,13,0,0,0,0,0,0,4
14,True,Any one know anything about the military helicopters in LA,False,,0,False,0,0,0,0,False,False,,5,0,,False,False,conspiracy,795126,14,2880,-1,58,10,10,4,6,-1,233,45,35,15,20,4
0,True,What happened to Susan Lindauer? I seriously need help understanding this...,False,,0,1550096843.0,2,1,2,0,False,False,,43,1,,False,False,conspiracy,795126,0,2880,-1,72,11,11,4,7,1,2311,445,231,69,162,4
32,True,Anyone know a good list of murdered journalists reporting on high profile topics? The list is so long I don’t know where to start. Panama papers journalist Daphne Galizia is tied with Gary Webb for #1,False,,0,False,0,0,0,0,False,False,,26,0,,False,False,conspiracy,795126,32,2880,1,197,37,34,13,21,1,346,62,52,21,31,4
10,True,"Censoring Nutrition Conspiracy: Facebook blocks keto diet post for ""False, Misleading, or Deceptive Claims""",False,,0,False,0,0,0,0,False,False,,14,0,,False,False,conspiracy,795126,10,4320,-1,102,14,14,2,12,0,0,0,0,0,0,4
7,True,"Thanks to Trump's tax cuts, Bezos' Amazon paid $0 in federal income taxes on a staggering $11.2 billion in profit. Due to new tax laws Amazon actually paid a tax rate of NEGATIVE 1%. Is this fair? How much did you pay?",False,,0,False,0,0,0,0,False,False,,26,0,,False,False,conspiracy,795126,7,4320,1,209,44,37,11,26,1,828,157,103,32,71,4
35,True,Do you think mods are being paid off?,False,,0,False,0,0,0,0,False,False,,30,0,,False,False,conspiracy,795126,35,4320,0,36,8,8,5,3,1,142,28,26,12,14,4
86,True,"Netanyanu Tweets Then Quickly Deletes He Is Seeking ""War With Iran""",False,,0,False,0,0,0,0,False,False,,16,0,,False,False,conspiracy,795126,86,4320,1,65,11,11,4,7,0,0,0,0,0,0,4
1221,True,Dan Schneider of Nickelodeon is known for making his young female stars show their feet on TV. Very blatant evidence of Schneider's foot fetish and attraction to young girls. Incredibly disturbing to look back and remember that Nickelodeon's logo used to be an orange foot. Really creepy Network IMHO,False,,0,False,0,0,0,0,False,False,,245,1,,False,False,conspiracy,795126,1221,4320,-1,297,51,42,13,29,0,0,0,0,0,0,4
9,True,Dark money is pushing for a no-deal Brexit. Who is behind it?,False,,0,False,0,0,0,0,False,False,,6,0,,False,False,conspiracy,795126,9,4320,-1,59,13,12,6,6,0,0,0,0,0,0,4
18,True,Illhan Omar is unabashedly killing it in the foreign relations committee hearing:,False,,0,False,0,0,0,0,False,False,,26,0,,False,False,conspiracy,795126,18,4320,-1,80,12,12,4,8,0,0,0,0,0,0,4
3,True,Climate change hysteria is population control for advanced nations,False,,0,False,0,0,0,0,False,False,,9,0,,False,False,conspiracy,795126,3,4320,1,66,9,9,2,7,0,0,0,0,0,0,4
2,True,A request,False,,0,False,0,0,0,0,False,False,,14,0,,False,False,conspiracy,795126,2,4320,0,9,2,2,1,1,-1,316,62,53,21,32,4
32,True,Eighty per cent of Vatican priests are gay.,False,,0,False,0,0,0,0,False,False,,17,0,,False,False,conspiracy,795126,32,4320,1,42,8,8,2,6,0,0,0,0,0,0,4
4,True,Maduro DESTROYS BBC interviewer,False,,0,False,0,0,0,0,False,False,,8,0,,False,False,conspiracy,795126,4,4320,0,31,4,4,0,4,0,0,0,0,0,0,4
27,True,People from CDC are harassing my neighbors!,False,,0,False,0,0,0,0,False,False,,77,0,,False,False,conspiracy,795126,27,4320,0,42,7,7,3,4,-1,1275,244,136,49,87,4
5,True,"If they’ll keep censoring us here, where should we all run to next?",False,,0,False,0,0,0,0,False,False,,14,0,,False,False,conspiracy,795126,5,4320,0,65,14,14,9,5,1,236,41,35,13,22,4
157,True,"Is the CIA smuggling arms and equipment into Venezuela? Boeing 767 flies 40 round trip flights since Maduro was sworn in, ceases flights when exposed.",False,,0,False,0,0,0,0,False,False,,28,0,,False,False,conspiracy,795126,157,4320,-1,147,25,24,7,17,0,0,0,0,0,0,4
0,True,Are you under satanic influence?,False,,0,1550090954.0,0,0,0,0,False,False,,61,0,,False,False,conspiracy,795126,0,4320,0,31,5,5,3,2,-1,124,21,20,10,10,4
10,True,"Newark, N.J. More than 180 priests named as accused abusers",False,,0,False,0,0,0,0,False,False,,2,0,,False,False,conspiracy,795126,10,4320,1,57,11,11,3,8,0,0,0,0,0,0,4
11,True,9/11 Pentagon Evidence Summary Wayne Coste's narrated by David Chandler,False,,0,False,0,0,0,0,False,False,,2,0,,False,False,conspiracy,795126,11,4320,0,71,12,12,2,10,0,0,0,0,0,0,4
1,True,"In The Information Age, You Get What You Create",False,,0,False,0,0,0,0,False,False,,4,0,,False,False,conspiracy,795126,1,4320,0,46,9,8,4,4,0,0,0,0,0,0,4
9,True,"RIP, Opportunity! NASA rover finally bites the dust on Mars after 15 years",False,,0,False,0,0,0,0,False,False,,15,0,,False,False,conspiracy,795126,9,4320,0,72,13,13,3,10,0,0,0,0,0,0,4
45,True,"17,000 Dead Babies in a Shipping Container",False,,0,False,0,0,0,0,False,False,,26,0,,False,False,conspiracy,795126,45,4320,-1,42,8,8,2,6,0,0,0,0,0,0,4
3,True,"Blackmail and the ""Shadow Government""",False,,0,False,0,0,0,0,False,False,,6,0,,False,False,conspiracy,795126,3,4320,0,35,5,5,2,3,1,2311,461,235,71,164,4
38,True,"Flu shots...what a dilemma. So far, in the past three years, we have avoided the flu in our house, coincidentally having stopped taking the flu vaccine just three years ago. In years past, like clockwork, we’d get the flu after getting the shot. My child’s pediatrician doesn’t vaccinate her kids!",False,,0,False,0,0,0,0,False,False,,82,0,,False,False,conspiracy,795126,38,4320,-1,286,54,40,17,23,1,47,8,8,4,4,4
4,True,"CIA may have used contractor who inspired ‘Mission: Impossible’ to kill RFK, new book alleges",False,,0,False,0,0,0,0,False,False,,1,0,,False,False,conspiracy,795126,4,4320,-1,89,15,15,3,12,0,0,0,0,0,0,4
36,True,N.J. Catholic dioceses release names of 188 priests and deacons accused of sexual abuse of children,False,,0,1550092584.0,0,0,0,0,False,False,,4,0,,False,False,conspiracy,795126,36,4320,1,98,17,15,2,13,1,743,122,78,28,50,4
15,True,Here’s a pic of the coloring book,False,,0,False,0,0,0,0,False,False,,27,0,,False,False,conspiracy,795126,15,4320,0,33,8,8,5,3,0,0,0,0,0,0,4
4,True,How Paul Manafort Couldn’t Stop Colluding With a Suspected Russian Intelligence Associate,False,,0,False,0,0,0,0,False,False,,5,0,,False,False,conspiracy,795126,4,4320,0,89,13,13,5,8,0,0,0,0,0,0,4
0,True,Former Mossad agents formed company that targeted Clinton campaign,False,,0,False,0,0,0,0,False,False,,1,0,,False,False,conspiracy,795126,0,4320,0,66,9,9,1,8,0,0,0,0,0,0,4
37,True,"California kills 73% of bullet train, keeps 100% of taxes",False,,0,False,0,0,0,0,False,False,,15,0,,False,False,conspiracy,795126,37,4320,0,54,10,9,1,8,0,0,0,0,0,0,4
26,True,New Book Alleges Deep CIA Involvement in Robert F. Kennedy's Assassination,False,,0,False,0,0,0,0,False,False,,5,0,,False,False,conspiracy,795126,26,4320,1,73,12,12,2,10,-1,342,58,51,21,30,4
0,True,State power now being used to force parents to transgender their kids,False,,0,False,0,0,0,0,False,False,,4,0,,False,False,conspiracy,795126,0,4320,0,69,12,11,4,7,0,0,0,0,0,0,4
18,True,MSNBC Terrified of AntiWar Voices,False,,0,False,0,0,0,0,False,False,,1,0,,False,False,conspiracy,795126,18,4320,0,33,5,5,1,4,0,0,0,0,0,0,4
7,True,x Lloyds rocked by new whistleblowing claim: Insider says bank drove companies to bankruptcy and seized small business assetts intentionally shore up Lloyd’s,False,,0,False,0,0,0,0,False,False,,5,0,,False,False,conspiracy,795126,7,4320,-1,156,24,24,5,19,0,0,0,0,0,0,4
0,True,Lula da Silva’s Second Conviction Another Travesty of Justice,False,,0,False,0,0,0,0,False,False,,2,0,,False,False,conspiracy,795126,0,4320,0,61,10,10,2,8,0,0,0,0,0,0,4
12,True,Private Mossad for Hire,False,,0,False,0,0,0,0,False,False,,1,1,,False,False,conspiracy,795126,12,4320,0,23,4,4,1,3,0,0,0,0,0,0,4
12,True,The Occult Masonic symbolism of Mozart's opera The Magic Flute,False,,0,False,0,0,0,0,False,False,,10,0,,False,False,conspiracy,795126,12,4320,1,62,11,10,3,7,0,0,0,0,0,0,4
8,True,N.Dakota bill #2209: Public records to be sealed... leaving many questions unanswered,False,,0,False,0,0,0,0,False,False,,3,0,,False,False,conspiracy,795126,8,4320,1,80,13,13,2,11,0,0,0,0,0,0,4
4,True,A Great American Hero? No...an American War Criminal.,False,,0,1550260486.0,0,0,0,0,False,False,,7,0,,False,False,conspiracy,795126,4,4320,1,49,9,8,3,5,1,3226,542,300,64,236,4
48,True,"The United States has been in a near-constant state of emergency for 40 years. Since Jimmy Carter, there have been 58 National Emergencies declared for many reasons. Here is a list of them",False,,0,False,0,0,0,0,False,False,,9,0,,False,False,conspiracy,795126,48,4320,1,185,34,30,12,18,1,4750,665,207,22,185,4
2,True,Pirate Radio Impersonating Glenn Beck caught in the act,False,,0,False,0,0,0,0,False,False,,5,1,,False,False,conspiracy,795126,2,4320,0,55,9,9,2,7,0,0,0,0,0,0,4
14,True,"An ""Activist"" (according to adult news): angry people with a preachy message - But what is an Activist, really? Those who build collectively bettering a common cause. Let's avoid the hate, and rebuild our world.",False,,0,False,0,0,0,0,False,False,,7,0,,False,False,conspiracy,795126,14,4320,-1,199,35,32,13,19,0,0,0,0,0,0,4
20,True,Former U.S. Counterintelligence Agent Charged With Espionage on Behalf of Iran; Four Iranians Charged With a Cyber Campaign Targeting Her Former Colleagues | OPA,False,,0,False,0,0,0,0,False,False,,10,0,,False,False,conspiracy,795126,20,4320,0,157,24,21,6,15,0,0,0,0,0,0,4
0,True,"Documentary: Satan, the Illuminati, The beast, the New Age & the False Prophets",False,,0,False,0,0,0,0,False,False,,2,0,,False,False,conspiracy,795126,0,4320,-1,73,12,9,1,8,0,0,0,0,0,0,4
390,True,"California kills 73% of bullet train, keeps 100% of taxes",False,,0,False,0,0,0,0,False,False,,76,0,,False,False,conspiracy,795126,390,4320,0,54,10,9,1,8,0,0,0,0,0,0,4
0,True,Ruth Ginsburg... Is Dead,False,,0,False,0,0,0,0,False,False,,33,0,,False,False,conspiracy,795126,0,4320,-1,21,4,4,1,3,0,0,0,0,0,0,4
25,True,Have you heard the tale of Malvin Weisberg?,False,,0,False,0,0,0,0,False,False,,4,0,,False,False,conspiracy,795126,25,4320,0,42,8,8,4,4,1,1476,266,157,52,105,4
135,True,"TIL a lady named Joy Milne claimed to identify Parkinson's patients by smell. On testing , out of 50 patients, she had 98% accuracy. She did her latest trials at Manchester University. How many of us walk around with the ability to do something special like this, and we don't even know we can?",False,,0,False,0,0,0,0,False,False,,42,0,,False,False,conspiracy,795126,135,4320,1,285,55,50,22,28,0,0,0,0,0,0,4
200,True,The most terrifying moment of my life was when I realized 9/11 was an inside job. So scary that I subconsciously burried it in my mind because accepting the obvious evidence before my very eyes was just too much to handle.,False,,0,1550075603.0,0,0,0,0,False,False,,104,0,,False,False,conspiracy,795126,200,4320,-1,220,42,36,18,18,1,5327,975,453,99,354,4
0,True,Just a quick PSA.,False,,0,False,0,0,0,0,False,False,,5,0,,False,False,conspiracy,795126,0,4320,1,16,4,4,2,2,-1,66,14,12,4,8,4
81,True,MSNBC “Terrified of Antiwar Voices” Says Fired Antiwar Host Phil Donahue,False,,0,False,0,0,0,0,False,False,,14,0,,False,False,conspiracy,795126,81,4320,0,70,11,10,1,9,0,0,0,0,0,0,4
9,True,Twitter Bias Against Conservatives Proven By PhD Research,False,,0,False,0,0,0,0,False,False,,39,0,,False,False,conspiracy,795126,9,4320,0,57,8,8,2,6,0,0,0,0,0,0,4
290,True,We need to talk about the island of Jersey,False,,0,False,0,0,0,0,False,False,,101,0,,False,False,conspiracy,795126,290,4320,0,42,9,9,5,4,1,4237,747,355,72,283,4
3969,True,"Tulsi Gabbard Wants to Legalize Marijuana, Punish Big Pharma and End Private Prisons",False,,0,False,0,0,0,0,False,False,,766,0,,False,False,conspiracy,795126,3969,4320,1,83,13,13,2,11,0,0,0,0,0,0,4
0,True,Pushing Pertussis: Here are some facts to counter the pro-vaxxer whooping cough propaganda,False,,0,False,0,0,0,0,False,False,,4,0,,False,False,conspiracy,795126,0,4320,-1,89,14,14,5,9,1,4795,719,327,51,276,4
0,True,Senate Intel Finds no Collusion Between Trump and Russia,False,,0,False,0,0,0,0,False,False,,13,0,,False,False,conspiracy,795126,0,4320,0,56,9,9,3,6,0,0,0,0,0,0,4
3,True,All I can say too is Enough Is Enough,False,,0,1550078535.0,0,0,0,0,False,False,,3,0,,False,False,conspiracy,795126,3,4320,0,37,9,7,5,2,1,225,40,35,12,23,4
86,True,Venezuela Accuses U.S. of Secretly Shipping Arms After Weapons Found on Plane with Possible CIA Ties,False,,0,False,0,0,0,0,False,False,,9,0,,False,False,conspiracy,795126,86,4320,-1,99,17,17,5,12,0,0,0,0,0,0,4
36,True,John Bolton Threatens Iran Over Debunked Pursuit of Nuclear Weapons — “He clearly wants a war before Trump leaves office and shouldn’t be underestimated.”,False,,0,False,0,0,0,0,False,False,,7,0,,False,False,conspiracy,795126,36,4320,1,149,24,24,9,15,0,0,0,0,0,0,4
0,True,Written Testimony for HB 1638 - 2019-20 • Written and fully referenced by a full time working father,False,,0,False,0,0,0,0,False,False,,3,0,,False,False,conspiracy,795126,0,4320,1,96,17,16,4,12,0,0,0,0,0,0,4
1,True,"His name was Andrew Breitbart.....He told/showed us about ""Fake News"" before it was made into a thing.",False,,0,False,0,0,0,0,False,False,,17,0,,False,False,conspiracy,795126,1,4320,-1,95,19,18,8,10,1,1788,334,187,52,135,4
9,True,"With all of these accusations of Russian collusion, why hasn’t Julian Assange been pulled in for questioning?",False,,0,False,0,0,0,0,False,False,,7,0,,False,False,conspiracy,795126,9,4320,0,107,18,17,10,7,1,462,86,69,29,40,4
566,True,Nikola Tesla isn't generally taught in the school system. He has been supressed for a reason.,False,,0,False,0,0,0,0,False,False,,128,0,,False,False,conspiracy,795126,566,4320,1,91,17,17,9,8,0,0,0,0,0,0,4
15,True,Antonin Gregory Scalia was Murdered by powerful people in power(globalists),False,,0,False,0,0,0,0,False,False,,6,0,,False,False,conspiracy,795126,15,4320,1,74,11,11,3,8,1,684,117,72,23,49,4
15,True,"Snopes: The Ultimate Disinformation ""Debunker""",False,,0,False,0,0,0,0,False,False,,14,0,,False,False,conspiracy,795126,15,4320,0,43,5,5,1,4,-1,241,49,40,18,22,4
103,True,Dual-Citizenship of Public Officials Creates Conflicts of Interest (White House Petition),False,,0,False,0,0,0,0,False,False,,72,0,,False,False,conspiracy,795126,103,4320,0,87,12,11,1,10,0,0,0,0,0,0,4
0,True,Cabellas forcing me to take hour lunch,False,,0,False,0,0,0,0,False,False,,16,0,,False,False,conspiracy,795126,0,4320,0,38,7,7,2,5,1,301,62,49,22,27,4
402,True,The media seems to have latched into the narrative that Obama had a scandal free 8 years. An absurd lie. Here is a list of scandals involving Attorney General Eric Holder. Some are stunningly criminal.,False,,0,False,0,0,0,0,False,False,,137,1,,False,False,conspiracy,795126,402,4320,-1,197,35,33,13,20,-1,13034,2176,802,83,719,4
4,True,Anti-War Quotes: Some of the people against war might surprise you!,False,,0,False,0,0,0,0,False,False,,2,0,,False,False,conspiracy,795126,4,4320,0,65,12,11,5,6,0,0,0,0,0,0,4
238,True,"Ilhan Omar is right about the influence of the Israel lobby. AIPAC essentially controls Congress, and someone has finally stood up and said so.",False,,0,False,0,0,0,0,False,False,,112,0,,False,False,conspiracy,795126,238,4320,1,140,24,22,8,14,0,0,0,0,0,0,4
58,True,"Extremely recent (within 24 hours) interview with Amy Biank, the American John of God tour guide whose blog documented many accusations as early as 2009. She knew he was a predator before he was on Oprah.",False,,0,False,0,0,0,0,False,False,,9,0,,False,False,conspiracy,795126,58,4320,1,199,36,33,10,23,0,0,0,0,0,0,4
2,True,Scenes - Delusion,False,,0,False,0,0,0,0,False,False,,6,0,,False,False,conspiracy,795126,2,4320,0,15,2,2,0,2,0,0,0,0,0,0,4
10,True,Bans,False,,0,False,0,0,0,0,False,False,,11,0,,False,False,conspiracy,795126,10,4320,0,4,1,1,0,1,-1,910,163,108,40,68,4
0,True,Scientists debate Flat Earthers,False,,0,False,0,0,0,0,False,False,,11,0,,False,False,conspiracy,795126,0,4320,-1,31,4,4,0,4,1,293,55,41,11,30,4
0,True,As all DNA is the same and we share 50% of our DNA with a Bannana.,False,,0,False,0,0,0,0,False,False,,24,0,,False,False,conspiracy,795126,0,4320,0,64,16,15,11,4,-1,125,21,20,9,11,4
0,True,US Navy Missile Instructor talks Flat Earth,False,,0,False,0,0,0,0,False,False,,89,0,,False,False,conspiracy,795126,0,4320,-1,43,7,7,0,7,0,67,15,13,7,6,4
4,True,Pathways to conspiracy: the social and linguistic precursors of involvement in Reddit’s conspiracy theory forum,False,,0,False,0,0,0,0,False,False,,7,0,,False,False,conspiracy,795126,4,4320,1,110,16,15,6,9,0,0,0,0,0,0,4
3,True,Women’s March divides progressive Jewish women in United States. When the subversive agendas of Zionism and Globalism clash....,False,,0,False,0,0,0,0,False,False,,1,0,,False,False,conspiracy,795126,3,4320,0,122,19,18,6,12,0,0,0,0,0,0,4
9,True,YouTuber Ally Law charged with stealing cup of tea.,False,,0,False,0,0,0,0,False,False,,6,0,,False,False,conspiracy,795126,9,4320,0,50,9,9,2,7,0,0,0,0,0,0,4
1290,True,People over at r/Technology are pretty woke about the level of censorship on reddit. [x-post about massive level of censorship gets 50k upvotes at r/tech],False,,0,False,0,1,0,0,False,False,,191,2,,False,False,conspiracy,795126,1290,4320,1,151,28,22,7,15,0,0,0,0,0,0,4
10,True,"What if we live inside a computer, but not in a simulation?",False,,0,False,0,0,0,0,False,False,,8,0,,False,False,conspiracy,795126,10,4320,1,57,12,11,7,4,1,2953,539,231,67,164,4
0,True,All you anti flat earther people are missing out.... i find it the most fun conspiracy to research. btw i'm not a flat earther.... but....,False,,0,False,0,0,0,0,False,False,,19,0,,False,False,conspiracy,795126,0,4320,1,125,26,23,13,10,1,380,70,59,26,33,4
14,True,What brought you to this subreddit?,False,,0,False,0,0,0,0,False,False,,69,0,,False,False,conspiracy,795126,14,4320,0,34,6,6,4,2,-1,222,43,37,19,18,4
55,True,"Given the trend in YouTube documentaries getting taken down, let’s discuss ways to preserve them.",False,,0,1550051057.0,0,0,0,0,False,False,,20,0,,False,False,conspiracy,795126,55,4320,-1,95,16,16,6,10,1,1083,191,116,39,77,4
0,True,Consciousness is a sexually transmitted virus. A super virus if you will. The very same one that survived the flames after we first learned to cook meat. Hence why the consumption of it lead to increase in brain size. Like reverse-Rabies.,False,,0,False,0,0,0,0,False,False,,5,0,,False,False,conspiracy,795126,0,4320,1,233,42,37,16,21,0,0,0,0,0,0,4
3,True,"Anyone who knows where youtuber ""Bright insight"" is?",False,,0,False,0,0,0,0,False,False,,15,0,,False,False,conspiracy,795126,3,4320,1,49,8,8,3,5,1,105,22,21,8,13,4
1,True,US Government Shutdown (2018-2019): Massive cyber security breach may lead to a new form of cyberwarfare?,False,,0,False,0,0,0,0,False,False,,3,0,,False,False,conspiracy,795126,1,4320,1,101,17,17,3,14,1,680,116,85,27,58,4
3,True,An accurate report on world news????,False,,0,False,0,0,0,0,False,False,,9,0,,False,False,conspiracy,795126,3,4320,1,32,6,6,2,4,-1,290,55,44,20,24,4
0,True,I just wanted to add this here to help people post more clearly. Socialism isnt a form of government. I feel like this truth causes peiple to misrepresent their ideas here and wanted to share.,False,,0,False,0,0,0,0,False,False,,37,0,,False,False,conspiracy,795126,0,4320,1,189,35,28,10,18,1,1323,225,127,40,87,4
24,True,Flint Michigan,False,,0,False,0,0,0,0,False,False,,15,0,,False,False,conspiracy,795126,24,4320,0,14,2,2,0,2,1,311,54,42,14,28,4
9,True,New eugenics documentary ad on YouTube.,False,,0,False,0,0,0,0,False,False,,10,0,,False,False,conspiracy,795126,9,4320,1,38,6,6,1,5,1,459,90,66,23,43,4
97,True,Russia is going black. I'm surprised no one is really talking about it.,False,,0,False,0,0,0,0,False,False,,95,0,,False,False,conspiracy,795126,97,4320,1,69,14,13,6,7,1,520,93,72,29,43,4
14,True,"I’m following an account for Revlon beauty, don’t know how. They have no posts, no comments. They’re 7 days old. What’s up with that?",False,,0,False,0,0,0,0,False,False,,7,0,,False,False,conspiracy,795126,14,4320,1,127,28,26,16,10,0,0,0,0,0,0,4
32,True,Bombshell! Video Mashup Reveals Pathetic RussiaGate Coverage,False,,0,False,0,0,0,0,False,False,,18,0,,False,False,conspiracy,795126,32,4320,-1,59,7,7,0,7,0,0,0,0,0,0,4
23,True,We need to talk about censorship.,False,,0,False,0,0,0,0,False,False,,14,0,,False,False,conspiracy,795126,23,4320,0,32,6,6,3,3,-1,509,99,71,25,46,4
221,True,We are at war.,False,,0,1550100396.0,0,0,0,0,False,False,,204,0,,False,False,conspiracy,795126,221,4320,0,13,4,4,3,1,1,4383,860,350,85,265,4
0,True,Bethesda made fallout76 shit so the next elder scrolls game will seem good just by comparison,False,,0,1550039844.0,0,0,0,0,False,False,,8,0,,False,False,conspiracy,795126,0,4320,1,93,16,16,5,11,-1,416,82,60,32,28,4
8,True,Twitter blocks all Natural News / Health Ranger channels after Adams comments on the Jack Dorsey / Joe Rogan Bitcoin fraud,False,,0,False,0,0,0,0,False,False,,14,0,,False,False,conspiracy,795126,8,4320,1,118,19,19,4,15,0,0,0,0,0,0,4
123,True,Court ruling confirms Gardasil vaccine kills people… scientific evidence beyond any doubt… so where is the outcry?,False,,0,False,0,0,0,0,False,False,,62,0,,False,False,conspiracy,795126,123,4320,0,111,17,17,5,12,0,0,0,0,0,0,4
12,True,"Chuck E. Cheese 'recycles' uneaten pieces of pizza to form new pizzas, to then serve to customers.",False,,0,False,0,0,0,0,False,False,,32,0,,False,False,conspiracy,795126,12,4320,1,93,17,15,3,12,0,0,0,0,0,0,4
0,True,are reptilian shapeshifters real? or are these clips photoshopped?,False,,0,False,0,0,0,0,False,False,,20,0,,False,False,conspiracy,795126,0,4320,1,64,9,8,3,5,0,0,0,0,0,0,4
65,True,"NASA Discovers Second Crater Hidden Under Greenland's Ice — Even more surprisingly, it’s the second crater discovered under the region’s thick ice in recent months.",False,,0,False,0,0,0,0,False,False,,20,1,,False,False,conspiracy,795126,65,4320,1,160,27,20,6,14,0,0,0,0,0,0,4
0,True,"just a thought, might seem rediculous",False,,0,False,0,0,0,0,False,False,,13,0,,False,False,conspiracy,795126,0,4320,0,36,6,6,2,4,1,266,47,41,13,28,4
